selftext,num_comments,score,title
life fi life fi silent slow week weekend come go day day work plough hanging tight high low update skill stay abreast year still left rest save up save investkeep tracking asset glamor bling it fairly boring thingto wait watch wait growa slowly rising portfolio take patience saintto work wait complaint invested body mind soulwith eye set distant goal like tiger tracking preythe working man awaits day armed knowledge plan he tough persistent man life fi all only diligent hear call it take hard work industryto make it financially free,1,1,The Life of FI
late got clearance interested tech cyber security nursing basically anything generate income k passion place feeling anxious father cancer moving away soon leaving support mom dog mortgage want plan quick good studying memorization lack discipline study alone try looking certification degree advance quicker financial business related degree good high paying career wide availability dc area preferably,4,1,How to move on up from here? I have a clearance.
hope right post here read rule think fine post here so bit confused confused actually save yearly limit k yearly ira account losing money investment one place like one index fund instead putting money separate investment account understand it investment fund it faster grow all thing equal assuming stock market growing yearly maybe employer contribution would make this certain point still behind different retirement account instead placing index fund or whatever individual investment account have depend long want keep money retirement account like say invest year withdrawing retire versus investing year withdrawing retire hope confusing anybody make sense help,34,1,"Wouldn't it be more beneficial to keep all your money in 1 single investment account, so the earnings will be greater, versus having 2 - 3 separate retirement accounts?"
cut spending bare minimum saving k year little more year see amount doubling much money need save let money make money k year comfortable me trying set new goal current goal save like year cut schedule own business partner travel more achieve best way possible resource book guy recommend,8,1,How much capital do you need to let your money make your money for you?
year old brother receive inheritance around k soon k currently sitting dormant k understand taxed income withdraw money mother leaving u money asked manage bulk asset brother i currently active retirement brokerage account looking solely best way maximize inheritance brother i prefer invest using vanguard index total u market total international market bond equity risk following age rule scenario keeping tax mind want withdraw fund immediately would calculate tax bracket would increase try avoid pulling i make k yr brother k withdraw regularly put regular contribution scenario withdraw everything trying share burden tax increase immediately plop lump sum desired allocation anyone provide insight risk reward scenario assume scenario simply lower risk lower reward maybe thinking clearly it,0,1,Receiving inheritance in the next few months
hey guy im get yearly bonus friday amount around dollar imagine ill see somewhere around tax ive already deposited roth wanted use fund remainder year thats normally spend roth every year due poor financial decision unexpected decision emergency around k k thought even fund roth fully ill still leftover bring e fund back bit k then could divert contributing roth about month e fund build back since roth full year market coronavirus stuff making think save whole thing worst case scenario try contribute regularly roth prioritize maxing out reference little background work chemical engineer mass biotech company make around k feel like job pretty secure obviously dont want count always especially recession actually occurs k net worth basically invested index fund besides e fund mentioned cash also rental property owner occupy get month rent spend k k month including mortgage really varies significantly depending big expense pop up lose job could certainly keep expense down also live fianc hedge risk case one u loses job would position thank much advice,11,1,Should I max out my Roth IRA using my yearly bonus or should I save for a possible recession?
amp xb gt suppose saving account interest rate per year year much think would account left money grow answer a b exactly c le d know e refuse answer imagine interest rate saving account per year inflation per year year much would able buy money account answer a today b exactly same c le today d know e refuse answer please tell whether statement true false buying single company stock usually provides safer return stock mutual fund answer a true b false c know d refuse answer even millennials self identified financially literate struggled group able answer three question correctly the answer a c b amp xb amp xb amp xb im posting many people believe ally saving account generating wealth,3,1,New report finds only 16% of millennials qualify as ‘financially literate’
video explains whole story case interested video made k would love make video full time sure model scalable nevertheless making youtube content bit like buying lottery ticket worst make bit cash always chance hit jackpot find niche allows financially independent question small k sub youtuber method income welcome,3,1,I earn about £8k from YouTube from about 2 hours work each weekend
wife finished meeting tax preparer left confused understanding used post tax dollar contribute traditional ira could deduct tax however tax preparer stated since didnt use pre tax dollar could claim deduction thats case whats benefit traditional ira brokerage account since know importance joint income k pre tax,18,1,Traditional IRA tax question
recently purchased car suspect dealership finance guy made pretty big mistake initially told would pay car well never did however paper work seems indicate did sure find mistake eventually right work anyone experienced before,4,1,Car dealership made a big mistake
ira roth ira conversion wait year withdraw converted amount without penalty even im and wait every conversion new year wait thanks,0,1,IRA to Roth IRA conversion 5 year wait time
earn last year earned income use money put towards ira next year previous year money eligible contribution forward year,2,1,IRA Contributions
year treasury yield lt want discus different fixed income option amp xb default aggregate bond fund pro easy buy brokerage account market value increase interest rate drop often cushioning fall equity allowing rebalance equity market correction con current rate low market value drop interest rate drop credit rating issuer drop default amp xb certificate deposit cd pro lock right now see latest rate different bank fdic insurance protects principle con open account different bank chase rate nearly impossible k ira see brokered cd bought brokerage account early withdrawal penalty amp xb i bond pro current rate inflation buy may much higher current tip yield protects unexpected inflation similar tip principle cannot go down u treasury thus exempt state tax interest tax free used education con locked year early withdrawal penalty withdrawn within year must open treasurydirect account limited k k via tax refund year scalable amp xb ee bond pro rate work least held year similar bond exempt state tax tax free used education con interest rate near withdrawing year yearly contribution limit bond,5,1,Alternatives to bonds [US]
graduating may company match k next month currently contributing month k owe required start paying since still student thinking stopping k since match begin paying per month starting today towards loan amp xb student loan are amp xb interest already accruing interest already accruing interest already accruing interest already accruing,1,1,Should I stop contributing to my 401k to pay off my student loans faster?
curiosity people similar boat started investing immediately last recession between withdrawing market looming threat recession mean great bull run now risk investment gloomy market also s amp p really overvalued trillion gdp several country combined,4,1,"Does it make sense for people, who started investing immediately after last recession (between 2008-2010), to withdraw from market because of looming threat of recession?"
saw news bill gate guess u ball park him however always discussion purpose fire me important part fire money problem solved throwing money longer problem guess might suitable another sub r fatfire,3,1,This is what FI meant to me. Being in the position to make a difference to the lives of those around you
starting k new job managed ohio national financial service two fund look interesting one fund track s amp p the s amp p geode expense ratio another fund look interesting vanguard mid cap value index fund expense ratio considering splitting contribution evenly two fund would get diversity s amp p vanguard fund higher expense ratio high would negate advantage diversifying fund,3,1,Need help selecting funds for my new 401k
someone chose use bank would irs find much money person earns owes tax,4,1,IRS?
occurred since expect u index fund grow faster international bond index fund u index fund tax advantaged account missing something obvious see rebalancing tricky assume solution here,8,1,"For a 3 fund portfolio, should I make sure my US index fund is in my tax advantaged accounts, while slower growing aspects are in taxable account?"
dont know belongs financial independence seems active suitable place question k go roulette table place k red black odds winning losing doubling money say lose first time double wager k place k wager win k youve made k profit forgive ive missed something ive never actually attended casino big gambler,7,1,What stops casinos from going bust?
living paycheck paycheck recently raise do,7,1,Just got a $5 raise. On salary. Best way to take advantage?
im u citizen recently married non citizen partner still filing stage green card looking like investing option limited granted looking like process going take whilepotentially year vanguard wont let create account non resident alien anyone suggestion might spouse investment name they too fully catch fire bug,5,1,Investing Options for International Spouse
house worth k pay next year purchased k sell house dont want hit huge tax bill anyone able avoid that would rather buy another house way around it,7,1,Question about avoiding taxes after selling a house.
tax day delayed july th ira contribution cutoff also delayed rumor might delayed september th case isn know still contribute contributed full k last year deadline coming soon,60,1,PSA: You still have 20 days left to max your IRA for 2019. Also: you only have 20 days left
hey im entering first full year public school system im wondering teacher way have achieved fire form im looking extra motivation year start,5,1,Any DINK teachers trying to CoastFire?
want sound like idiot really really really proud myself wife bought first house year ago land contract paid full today self employed house usual house sq ft quirk flaw outright managed pay month early during pandemic completely avoid k balloon payment making extra monthly payment biggest accomplishment life far feel like need express happy somewhere now paying car saving new house closer town space,3,1,Was told I should cross-post here. Just paid off my land contract! Feeling proud.
sharing personal life past experience building selling company achieving life dreamed financial independency empty wa lesson learned look meaningful life always health first time precious challenge make alive happy saving money temporary spend wisely intro id working year brazil mainly software engineer tech lead different software development agency hectic environment norm hour month month weekend exercise like im young it problem then sudden felt irregular heart rate felt heart beating faster day situation led hospital visit burnt detected told reduce workload least heart everything else completely fine this problem would change mindset forever solution worrying life left company planned spend year taking care myself work all at time living home kid year saving facilitated decision new mindset never work many hour worry work much health next month forced sabbatical got call former colleague job proposal no ill stay year work contract working home time sent proposal considering hr day higher rate extended delivery date ok agreed fast forwarding year co created bb product similar qlikview geckoboard pace month without pressure working normal hour took u month strike first sale company one ran company year co founder one working full time client employee project realistic deadline allow pressure client deliver earlier extra hour flexible time mostly could work whenever wherever wanted to following deliverable also allowed work le hour enjoy chased freedom we thriving finally dreamed life everything running accordingly long hour holiday abroad time exercise low figure revenue great profit highly efficient employee dreamed life arrived make even better received offer sold company something north time yearly earnings moving abroad money hand time u my wife i take biggest decision life move abroad hot sunny brazil london ill write another post reason decided move im top world now time wished for travel lot dont need work im successful anything launch profitable know make money travelled didnt look new job all invested time side project diverse list transport option airport city centre list uk beer list videogames music everything going according plan well new lifestyle bringing real happiness having anything dreamed without clear purpose meaningless adding this side project helping anyone this made realise invincible arrogantly thought meaning life one purpose moving abroad raise kid safer country le problematic politics then sticking original plan time baby born year started dreamed empty life since then one important people world least him life clear objective difficult challenge best reward ever to make happy possible he happy im happy to raise without preconceived view and many many more now im top world today world since working project manager product owner year employer why mind need active empty mind suck make feel alive need income load positive point now like day holiday clear direction bos learn from working industry im passionate sport career progression etc future im chasing dream again launching something help people why see real joy helping people solve problem spend quality time family time never come back freedom work whenever wherever im productive feel rush new client buy product now im sure im using time money way wisely before,325,2,Achieved my dreamed FIRE life...but it was meaningless
i criticizing capitalism wealth accumulation building much wealth possible one main goal life inescapable fact people like fi community strive obtain significant wealth depend heavily status quo i year old look future hard time imagining capitalism survive st century everything read studied current era rampant economic inequality most notably piketty capital twenty first century tell inexorably trending toward major restructuring economy society large fi folk arguably lose major change economic status quo could dead wrong wrote anybody else concerned this could someone protect major restructuring economic model,226,1,Is anybody concerned about the medium-term to long-term stability of the capitalist system?
work towards semblance fire keenly aware moving area lower cost living would help freeing worried could move feel comfortable gay couple able access lgbt healthcare currently live nyc also aware anywhere else country would it anyone else concern people moved also able save lot car walking taking public transit everywhere place good public transit,4,1,Moving for FIRE - LGBT
hey checkout new community business fact check,1,1,Check this out!
hi everyone first time posting new reddit amp community trying achieve fi like good folk here situation age half net worth k balance maxed year employer match roughly k yearly contribution self managed brokerage account comprised voo amazon google home depot draftkings learning go trying figure best strategy personal capital portfolio annual fee in saving cash with solid tax return amp bonus coming couple week totaling k k additionally partner currently net worth roth ira which maxed every year k with total contribution every year also self managed brokerage account valued think rest saving partner probably stop working year expense which includes retirement contribution net saving year end mostly brokerage account and sometimes lingers saving account partner stop working net roughly saving year time kid picture probably start paying mortgage year debt would like retire give take year arent already something stop doing open suggestion feedback advice yall have happy answer question thanks reading,0,1,"A 26 y/o &amp; their quest for FI, can you help?"
hi currently rental property slightly negative cash flow need major renovation mortgage free year trying decide keep it renovate it continue rent it sell invest balance market issue run number different way come number predict house appreciation rent appreciation stock market return depending plug in path yield long term wealth flip advice view situation,2,1,"How to choose: renovate and rent out condo, or sell it and invest the balance for early retirement."
early landed full time job university topped put pension worked year contributed monthly without knowing much it left vest pension left there fast forward close year lurking sub decided check it done pretty well point projected pay unexpected month age approx month retire early combined pension projected pay month current employer retirement saving well investment property currently valued k know proceed rejigging retirement planning providing everything move approx rate return next year line consider selling investment property along retirement saving letting ride pension kick in plan living lavish lifestyle currently debt opportunity retire earlier understand may leaving lot information please feel free ask thank,5,1,Discovered that I had a pension saved up from a full time job I took close to 20 years ago. Need some advice on how to strategically set myself up.
turned high school checking chase past couple year wanted know smart open new checking account well fargo promotion switch back chase month get better banking service,5,1,Switching into new checking account
opportunity go door door sale solar panel company job consists door door appointment setting solar panel claim big opportunity everyone k month starting off obviously guaranteed claim moving company making insane figure also full ride university anyone know field advice drop college pursue great opportunity stay college get degree thanks,5,1,Future in question.
often see discussion withdrawl rate sub rarely ever see anyone contemplating fireing switching growth investment high yield dividend investment living dividend income idea always appealed rather withdrawing money worked save let money work me without heavily researching specific also feel like safer long run all selling thing go south feel like would easier hold out seem like le piping option simply require much money withdrawl based fire approach critical detail missing,28,2,Withdrawl vs Dividends for FIRE
hi all everyone talk hitting fire number quickly possible also trying do hit number though preferred method employing capital sustainable safe return understand mixture stock bond history shown u always rely vehicle interest rate return normal would get nearly halfway high yield saving account money market fund research indicates preferred method interest dividend investment cd bond possibly annuity more option looking at specific recommendation flip switch today would easiest implement appreciate conversation,32,1,Investments that return 4% with reliability and minimal risk?
reading bunch last week think plan ok wanted ask sure one rollover per year rule count check written directly me far year rolled old job k new job fidelity old company mailed check written fidelity name next line sign scanned app also plan rolling traditional ira vanguard current fidelity k next year start back door roth thing probably every year going forward looked vanguard thing yet guessing send check would hopefully written fidelity matter want get stuck tax implication here thank you,1,0,Can I rollover an IRA and a 401k in the same year?
know key saving money consistently living mean often lifestyle tends expand whenever get salary increase careful expands beyond mean treat fancy clothes jewel new car vacation sunny destination often feel obliged put display false prosperity gratify ego earn esteem eye others primrose path lead overdue credit card statement missed payment wrecked credit score sleepless night eventually bankruptcy put right mindset avoid trap start building future upon rock think much people thinking saying way start living mean amp xb understand mean take home pay tax contribution important starting part much spend month to month amp xb downsize home possible ask yourself using space house guest room one us rarely so consider moving smaller residence amp xb save start pay first put money aside saving first amp xb reduce non essential need buy coffee cafe need buy clothes every month really need part budget amp xb keep track spending put receipt envelope put everything spreadsheet keep track service cancelled make sure charging you amp xb create budget do budget money need map create zero based budget i e nothing left expense saving amp xb use credit card wisely make sure pay balance regularly pay interest build credit rating get point cashback amp xb again stop worrying others saying focus building long term prosperity amp xb talk point youtube channel frugal wife,1,1,The Frugal Wife's tips for How To Live Below Your Means And Save Money || 7 Ways To Save Money
m married st kid way nw k mostly investment rental w k ira k k cash hand risk averse k left mortgage debt mortgage currently working hr week balancing w job self employment wife work full time combined income k stressed overworked managing people suck got baby way want miss life want present able spend time much want trying decide either scaling business back solo owner operator freedom flexibility schedule selling business keeping w job steady safe municipal job hr week commitment income benefit etc roughly self employment solo city job part want pay mortgage lower expense coast retirement around year old another part want keep grinding expense sanity mental health advice,25,1,Keep truckin' or coast into retirement?
interesting image want share all remember stay course,5,1,"Remember to buy and HOLD. Stocks picks on old phone, 2015."
hello friend long time commenter first time poster me k roth ira k cash good steady job moderate expense k mo target retirement year typical plan continue max ira build k cash saving start plowing excess vstax or whatever similar vehicle considering modification expense currently lower k k start buying vehicle now le saving right get k month putting saving considering k month saving k vstax wildcard career cyclical nature fairly regularly without inflow current job permanent funded beyond june working that saving tapped fill gap feel like put money market could basically tap pay cap gain amp xb thought play,33,1,Build Savings or Money Market?
mom diagnosed cancer look like going live year chemo doesn obviously much sooner late now lived long good life nobody family feeling disease sudden unexpected knew going die soon know cancer better idea timeline please nobody need share sympathy thank advance thought parent wealthy saw trust going me need hear others who personal experience handle million inheritance idea based experience open idea already attorney please suggest getting attorney lol sure accountant though i feel like smart expect be may research new competent one event want take early jump this planning well day mother pass something prefer do appreciate guidance please let know would position thanks amp god bless,7,1,Need advice from Multi-Millionaires
id like say k performing fairly well rate return id like open brokerage account diversify portfolio exact way k quickly save payment house emergency fund built up think hysas waste time since cant even keep inflation rate please dont suggest me terrible place keep money emergency fund im skilled enough day trading feel comfortable investing much money option could really fall as question is possible open brokerage account use invest mean k large med small cap foreign stock etc brokerage account advisable way save money,5,1,Brokerage Account Perform Like 401(k)
looking app sync account allow u budget certain goal analyze spending want avoid manual entry suggestion,9,1,Budgeting App for Household
im month im allowed get job graduate college not high school think drop out work butt school even fast food library wont let even babysit im allowed debit card kind understand im allowed spend money earn get cash extended family member go straight bank account access bank account im allowed know information it strictly college nothing else help financially successful future,21,2,How can I tell my parents they can trust me with money?
new subreddits sorry format usual living kent uk year sale experience obsession stock market wealth always seen becoming stockbroker current plan pull trigger would love see option there job offer similar salary potential well involved money stock maybe investment banker pro con option tl dr money hungry want work market becoming stockbroker option thanks reading advice helpful,1,1,"21 Money hungry, what's my best move?"
