selftext,num_comments,score,title
best buy house buy lease finance car literally discovered fire week thats mind thing is thinking possible hold house car im retired early goal retirement income annually would k sorry question place sound like fantasy maybe im ahead myself input appreciated,3,1,I’m new to FIRE and have a quick question regarding life during retirement.
plex fi re definition instead purchasing house buy four plex instead four plex take residential loan much easier get commercial loan live one unit rent three out continue work job income putting excess money paying mortgage paid off financial independence position bit better point already love real estate biz thinking writing landlord learning roadmap people would use method input fourplex fire,31,1,4-Plex FI/RE- Is anybody doing this?
title suggests searching hsa administrator employer offer one aware chose hdhp eligible open hsa know several market question this anything avoid paying fica tax hsa know employer sponsored hsa pay fica tax since opening one independent employer understanding fica tax would taken paycheck prior depositing hsa perhaps administrator integrate employer payroll hsa administrator would recommend cheap no fee looking anything fancy somewhere put money vtsax thanks advance help,121,1,Shopping for an HSA plan independent of employer
hi all hope type post allowed here wanted share quick story forgoing short term gratification back saved k summer internship well k side hustle tutoring another intern working summer internship also saved k end summer opened first brokerage account recommended same listen spent entire k top notch gaming pc invested k tm lly nvda ba now t mobile btu went chapter never sold company much initial k become today tm lly nvda ba now tmus k grew k gaming pc almost worthless really pay invest long term,5,1,Forgoing instant gratification for long term rewards!
main question skip putting money k goal retire early obviously tax benefit k great youre yr old need access money retire early cant get without big penalty im toying around idea k employer match putting extra fund normal brokerage account fully access money achieve financial independence number otherwise seems like fund locked away cant get them defeat purpose dont think ive ever seen topic discussed seems like everyone max k option first making separate investment well dont make enough money max yearly k allowance significantly invest outside that ill never get retire people thought this secondary question is earliest could reach fi number yr old throwing away much money retire year earlier skip k option,11,1,Investing in non-retirement accounts to gain financial independence
hey guy turn making k year somewhat financial role jersey city finance degree commute hr day need invest earn alot order invest grow im wondering anyone give tip feedback earn more live mom basement tiny room trying improve earning new worth k currently dept max retirement account,9,1,How can i increase my earning ablitiy?
hey all calculation expect portfolio year realized pretty good chance able pay house out right long now would require selling pretty large chunk stock got thinking reason investing need worry income pay bill could take largest bill one fell swoop would free thing would actually like instead grinding away current profession rocker describing shitty version baristafire advice would appreciated thanks,56,1,Alternative FIRE: Pay off your house first?
unsure kinda new game say buy k worth cba share buy another k dated d m y american dont get confused haha sell would get cgt deduction whole thing half none it australia help,1,1,CGT question
realize probably misguided current view everything earn toss personal saving account keep hearing oh invest this ira that brokerage account forth also aware wise put money something fully understand understand now investing mean risk like risk realize occasionally risk need taken but like money involved view investing way view gambling wrong mentality,13,1,Afraid of investing because I'm afraid I'll lose everything.
anyone else struggling fi re money either term spend invest better utilize it example maybe k right cash could use buy something sizable value feel background maxed roth ira year maxing k employer match dont want true k max extra cash paycheck allows liquidity personally like allocate k stock market instead buy something still make money value want buy k car k watch something like that currently living apartment naturally k could used payment house think ready feel couple year early s really essence wwyd k cash dont want put market buy house could start business quite desire idea moment,1,1,Anyone else struggling w/ not being sure what to do with extra cash?
finally ripe age finally finically independent earning average per week though self employed spent many year putting toxic relationship first mental breakdown last year following death baby son soon followed end abusive relationship extreme finical hardship start year amp homeless needle say broken person amp world dark place fast forward today sit nice new home feeling proud guess point post anyone reading struggling please give amp believe,1,1,Feeling good :)
hi everyone year old living nyc currently full time student going honor college pay tuition well full stack developer school really stuck wondering pursuit fi stripping identity grew athlete gifted academically played baseball since year old way sophomore year college quit division ii institution team work since lost k stock market spring made feel like work screwed still k cash always told spend it put little context made mistake put position lose much live emotionally abusive household w narcissistic father really trying move out which nyc need lot money even think affording house made lot emotionally driven therefore hasty decision cost heavy stock market tuition ever since quit baseball internship government agency second year hired graduate salary undergrad already gave raise working super prestigious project resume secondly entire office essentially intern got job offer school something seems super promising job income security future although cannot say would sought work already huge office culture desk job scene day worse others working short period i graduate make decision assuming give offer make do gripe day go thinking baseball wishing could playing fitting schedule granted enjoy getting weekend go practice practice alright dream it see friend used play still playing gut wrenching feel like almost impossible situation make clear decision on playing division ii baseball mean cannot job take night class giving free time baseball feel like happy medium playing normal competitive league used last summer long lost pound muscle since quit it feel like giant mountain would climb unfortunately nerd computer person naturally click typical college athlete anyways form many personal relationship teammate one bigger reason easy quit make even harder get back lot friend throw bullpen with etc theoretically could join team back play junior year nothing happened covid cancelled entire season last year so technically missed nothing would mean quitting job living portfolio return putting moving out freelance income sustain spending current asset k brand new car bought february fully paid off k year cd apy don remember exactly k investment portfolio k cash yearly expense k current income k year goal enough money move age feel like losing slightly really know figure one out tl dr nyc quit playing dii college sport pursue working fi moving toxic household day go think playing sport know play still working toward fi pace since would quit job many people play since typical jock athlete seemed age,4,1,Stuck Between a Rock and a Hard Place (20M)
hey all amp xb recently getting lovely concept question first working with hysa k k employer employer put pay check regardless contribution track max year traditional ira roth ira student loan debt rent still living home doctorate physical therapy salary k lovely debt income ratio age regret got much debt make salary am passion regard student loan work non profit gotten employment loan certified pslf made payment thus far relatively new grad problem working nonprofit year in profession non profit job quality much better private practice pay relatively similar question since want retire early make much sense max k ira monthly student loan payment income month lower agi lower student loan payment also need balance fact would like money real estate cannot touch age continue max ira k reduce agi thus monthly loan payment maximizing forgiveness year would love contribute roth since low tax bracket right now again would decrease agi would make sense put in say k k or even le use remaining money invest real estate stock market lastly hysa interest rate plummeted wondering put chunk taxable account reason want get real estate duplex house hacking waiting right property jump at could likely qualify fha loan need down amp xb thank all,2,1,Guidance regarding how to FIRE with PSLF program
intro sub often talk financial aspect receiving windfall want focus emotional aspect inheriting large money struggling emotion come receiving large sum managing emotion equally important managing money two often go hand hand would like share bit two different path brother took share emotional struggle receiving large sum money young age manage emotion hope post help people might similar feeling experienced brief background first year college year ago final grandparent passed away brother received lot money k each time received full ownership money year old grown million due money already invested what u receiving inheritance brother always hard worker something admire for working dead end job le enjoyed didnt pay well decided pursue something else year receiving money went master degree work stable job pay pretty well love life hcol area put large payment wonderful house renting room him would leave early morning get home later probably put hour every week time first couple year said brother hard worker many day week stressful exhausted got home settled job take work thing want indulges expensive hobby intention quitting job continues gain steady income sub recommended path work like would done hadnt received windfall enjoy benefit growing like struggle recommended path ill share done completed college hopped around trying different job first worked job field study worked retail bit tried different type job field study ended mental breakdown job next career decision took low cost living country work teaching english whatever reason really struggled working full time adapting adult life could argued inheritance contributed full time job really hard stay motivated rent satisfying basic need concern leave job easy transition thought isnt worth action im bad worker always arrived time shift rarely slacked off awhile job start realize job isnt really fulfilling working mental health look next thing think give sense fulfillment therefore dont know would adapted full time work even hadnt received inheritance guilt problem come receiving lot money im saying problem worse people problem one main one feeling guilt come receiving large sum year felt lot guilt whether personal societal pressure im sure arent exclusive people received money still want share think pretty common among people received windfall experienced varying degree different time list thing feeling like dont deserve didnt earn windfall feeling like im wasting potential dont something special opportunity money given me feeling like achievement lesser others feeling like solve people financial problem feeling bad spending money feeling like im allowed problem include separate struggle like people what helped guilt important work feeling guilt dont risk chance making unintelligent decision thing helped past really interesting view people deserve dont deserve people tend think good thing happen good people bad thing happen bad people reality lot life random might look people working hard get amount money given u feel guilty make sacrifice do all arent better deserve work like do remember person chose give deserved give money whoever wanted to think important constantly thankful people person gave you feel le guilty see money something given could pursue whatever want life make feel fulfilled happy also one thing therapist challenged think idea earning money earned initial net worth showing job exchanging labor money no additional earnings investment make earned money sense traditional sense sense every dollar gain money chose spend even could idea potential often associated career one aspect potential people mainly focus career potential people judge dont use money career start business really one potential life believe matter thats feeling fulfilled satisfied life whatever brings long term fulfillment figure truly important distinguish people think doing me working money also lot free time pursue hobby activity obviously change time aware brings satisfaction probably different even couple year now guilt potential play bit guilt achievement easy look people achievement compare own compare people life easy think im enough amplified false belief financial resource anything want mean could anything life really mean pursue anything willing make sacrifice for easy look another person income sub think wow put effort like person could make k too reality dont know true amount effort person put get there effort might even capable of dont know many thing person sacrifice amount stress endured goal motivated achieve level income know sacrificed personal achievement thing proud of important recognize people achievement also important recognize achievement take time proud them first reaction maybe too hearing someone financial difficulty want help them feel guilty money have would probably feel obligated help financially constantly would set path giving money away prevent reaching goal found time people end solving financial problem really looking vent even offering listening ear often good enough way help friend family im saying dont ever give money help people think charity helping friend family noble something would like point life feel income stable saying dont ever feel obligated give money people dont want arent comfortable it personally financial life goal im comfortable giving away large sum but charity important you select amount comfortable donating donate time help out especially play feeling deserving money received buy anything unearned money didnt really earn object shouldnt allowed enjoy something didnt earn type thinking ruin joy anything spend money on lot thing life im advocating spending without care world advocating guilt free spending help prevent overspending important still budget matter level wealth find amount comfortable spending per month year stick budget me take enough money cover basic need little extra fun money still leave enough let windfall continue grow easy go budget looking bank balance lot self discipline come play serf two purpose prevents buying thing frivolously time eroding windfall also creates artificial constraint begin want earn money said earlier large windfall made money le motivation me feel constraint spending even artificial one make want earn money skill exception make important medical related thing developing sort professional skill good really recommend sort skill freelanced struggle full time work important acknowledge wouldnt able pursue kind career path received inheritance feeling like still use skill earn additional money given quite lot personal satisfaction final point feeling like problem people judgmental fact life people tend look fortunate allowed complain thing problem thats true problem stressful someone worry making rent barely able feed family hell no someone stressful situation doesnt make problem le problematic me okay struggle guilt emotion come received large windfall conclusion hope thing written help bit navigate emotion receiving inheritance windfall would interested know way felt guilty way able manage guilt,193,1,Dealing with guilt associated with receiving an inheritance
let say wanted hedge u someone citizen holding usd vtsax people do currency stable buying etf euro yen,5,1,Best non US dollar emerging markets ETFs?
best investment opportunity magi greater k currently maxing k company doesnt match all bummer small company best investment opportunity long term plan also max ira much lower limit well hsa wanted also roth ira exceed income limit better option investing vehicle long term,4,1,Questions about greater 139k magi
ive following fire year read millionaire next door made motivated save large percentage gross income household income i make k quarterly benefit let round k net income wife who recently got work permit immigration hired part time assistant bring yearly net income roughly k cash flow expense living roommate naturally ran course recently locked lease monthly year entire floor brownstone brooklyn it truly blessing there new major change cash flow wife make roughly month new apartment cost monthly cooking gas included avg monthly saving internet cheaper avg monthly saving expect additional additional gross income saving investment last year saved month average new change projected gross saving month recently became acquainted option trading made killing lost even more im interested taking kind risk anymore dont want low yield saving account either dont want buy bunch etf time high either job doesnt offer k plan please enlighten option ira etc future plan still need set saving threshold early retirement option id like relocate southern mexico met wife rent live like royalty month buy multi unit live airbnb unit mortgage would k k airbnb regulation ironed mexico probably rent apartment night unit owner occupied would gross income occupancy buy house upstate college town commute first eventually rent semester living mexico alternate summer ideal living me summary where put money how much save please feel free give pointer thing consider thank,14,1,27 year old w/ 18k saved found dream rental in NYC. How to proceed
demat account necessity anyone looking invest indian financial market similar this trading account account important invest hold share security long term period trading account one buy sell share whereas demat account hold share electronic form therefore important demat account planning deal financial security simple word say demat account much different bank saving account demat account used hold security equity share ipo share bond mutual fund exchange traded fund etf government bond bank saving account used hold cash now lot confusion multiple demat account use many investor confused whether open second demat account not article aim address question penetrating mind many investor amp xb,1,1,Am I Allowed to Have Multiple Demat Accounts? – An Investor’s Guide
hey all young healthy medical issue prioritize health anticipate medical issue near future but never know course two option pay year eligible hsa not associated employer pay year eligible hsa regular medical expense medication etc would go annual bi annual check up however event emergency option would save money guess question is worth go option access hsa also spending year premium access hsa save year premium would effectively invest taxable brokerage account anyways also impression since hsa would independent employer would still paying fica medicare amp social security tax prior putting money hsa correct thinking this thanks advance,7,1,Should I pay higher premiums to be eligible for a HDHP HSA?
pretty new fire know making right decision looking house sd time suddenly average house jumped couple month re thinking good idea house k monthly roommate condo k monthly roommate renting house monthly roommate seems like condo better choice house appreciates more sure much risk buy condo san diego live in rent room buy house state invest buy fixer upper house san diego live rent room hope appreciates buy condo san diego rent one them continue renting san diego buy state good investment market,2,1,"Living in San Diego, continue to rent or buy. Condo or house?"
looking simple way make extra money every month dabbling dropshipping decided since college start lot dropshipping business originally thought right trying flip item find facebook going pretty meh decent deal far inbetween thinking buy couple nifty gadget aliexpress sell locally test item order like time inventory thought could decent side hustle,4,1,"Buying items on aliexpress and selling them locally (facebook market place, kijiji, etc), would this make for a decent side hustle?"
im child mom love want leave everything me dad opposite even though say leave me im afraid get chance not im concerned he one left go mom wish probably leave nothing give someone else dont really care happens curious dad power control mom half shes decide,11,1,"If one of my parent dies, does he/she have complete control of the will?"
friend father recently let go job year vested pension k well k question dont know far payout that two month thats start collect retirement money he terrible health alcoholic recently hospitalized bc depression drank bc lost job worried wont live long enough collect full pension full year money saved emergency fund he also getting hefty severance package thats worth another year expense month collect social security mention house paid well wife vehicle he well still depressed bc cant work three option collect pension payouts dy money stop collect pension wife co collector get le money payouts she bad health too stroke le year apart die money stop lump sum pension roll k take value pension told around k select cash option roll think wont pay tax cash roll the taxed government well do think cashing rolling k roth ira best situation,6,1,"Cash out pension, take payments, or roll it over?"
reason assumed mortgage lender wanted reasonable evidence could pay loan never realized pre qualify without day working company two year self employed guess continue paying rent unless get job,11,1,"TIL you can't qualify for first-time mortgages unless you've been employed for 30 days, even if your net worth is 10x the size of the loan."
tl dr panicked sold all went u treasury lost k compared nothing still fully back market like me know work pick asset allocation squirrel away rebalance roth conversion keep living cost low build tent mitigate sequence return risk sail sunset could go decided sell everything buy u treasury time journey known better april fortunately plan get back in plan indicate re entry august psychology already working best interest i get back now near high determined reinvest chunk would set limit order recent high trigger month end would change market order ensure entry well august saw pullback higher put august chunk set order sep got filled yesterday sell off back standard portfolio made spreadsheet position march compared portfolio august portfolio liquidated worth m portfolio would worth m untouched august missed capital gain say nothing dividend missed tax implication march perspective money invested would pay college tuition child anywhere year turn loss likely push retirement year keep target date spend k year le retirement could quit job bought yacht sailed world last month better off know like say financial advisor expensive worth it etc someone simply said don muppet stay course would earned year worth fee behavior gap difference asset class earns irrational fearful investor earns investing asset class real expensive good luck closing it stay safe there learn stupidity hope have,866,1,"Confession: I panicked, it cost me a lot. Don't let it happen to you, even if you have to pay for it."
so start back story i jobless lost job month ago though i tried looking new one failed find one really hard company eager hire amp xb since money saved steady stream income wanted start investing asked advice start learning stock market knew absolutely nothing amp xb spending hour hour everyday learning researching finally paid off managed earn almost stock market last week might much veteran incredible someone like struggling month ago amp xb everybody afraid getting started want risk losing money start best time start yesterday second best time now,1,1,"Recently, I have made about $15000. After being at a low in life, this feels great!"
hello lovely community never access k before finally do know much stock market besides classic invest aggressively young broad based index fund historically put everything vtsax learned employer offer vanguard offer several target retirement account which interest in offer following viiix large cap vmcpx mid cap vscpx small cap vtpsx int vbmpx total bond market understand viiix it basically s amp p seems pretty simple me put viiix would close vtsax possible vtpsx international exposure maybe vbmpx would like keep bond like aggressive early year would like hear people opinion early debt kid make low figure buy hold get rich slow strategy bit situation early engaged debt kid although plan road annual income low mid figure current nw k k vtsax k vgt k vbtlx k liquid cash emergency fund thanks thought appreciate it,1,1,401k Question
tax strategy help reduce taxable income outside maxing k house paid year household income close k almost w two child college prepaid car debt figure retirement plan working another yr anyone done synthetic mortgage idea,3,1,Tax Strategies for W2 Income
