selftext,num_comments,score,title
long time lurker reddit however recent discovery sub fire inspired create account make post talk finance folk irl oftentimes feel like winging alone hoping best necessarily think internet spot get financial advice small attempt get outside head feedback support constructive criticism said let start fire journey amp xb backstory born and live in u fortunate grow home lived well within mean learned great saving money management principal father able go high school college scholarship family money allowed work part time i number successful internship personal business put money towards personal expense car computer etc travel luxury importantly saving fast forward able graduate well paying job debt small pile cash looking seriously reason saving money figured need actual goal process place rather stowing away feel right fire seems like great goal have even life change along way regret closer security break budget later may line item lot people especially given time value money christian believe generous giving amp tithing see significant portion income dedicated end must admit time even find thinking what month allocated elsewhere something part life always be come top joy amp xb timeline net worth jan k saving year last semester college may k good semester contract work amp graduation gift june k little dip equity started working k salary and opened k jan k enjoying bull market retirement matching raise k today k saving saving saving amp xb allocation brokerage k equity investment keep night sometimes robobroker k roboinvesting etf rothira k equity investment brokerage higher risk long timeline amp tax benefit roboroth k roboinvesting etf rothk k roboinvesting etf emergency k roboinvesting super low risk tolerance amp xb monthly budget tax ouch giving see backstory rent expensive location multiple roommate living food gas gym etc discretionary hobby travel etc rothk company match moved building emergency saving expecting lose part rothira eligibility soon rothira always maxed however expect reverse eoy bonus general saving minimum k mo leftover living amp discretionary go here amp xb kindling flame likely eoy bonus around corner clue sized would conservatively guess k optimistically guess k known bad guesser though going scoff k either hopefully skirt without reverse rothira contribs think least portion get touched plan dump straight saving learned fire concept decided want start putting time energy finance towards goal going masochist it absolutely want maintain quality life also want find better way utilize income support this goal retirement retirement sake rather get position could take passion job without worrying income go take time serve community country dedicate time energy family cause etc think plenty room growth improvement operating thing open feedback thought speculation know may swallow pride name wiser investment choice anything may serve fun story look back develops,30,0,Starting With Embers at 23
advice poster running scenario firecalc com really great tool allows put nearly financial data portfolio balance composition start retirement long income needed pension s future contribution windfall etc figure historically situation would successful based starting year data situation retirement funded combination k b pension s windfall expect selling house moving abroad toying idea retiring year age wanted see income could generate without boring detail looked difference withholding pension age thereby increasing le k k withholding s age thereby increasing le k k much surprise holding year nearly double income resulted le successful retirement every metric firecalc show ran scenario starting income k running age cpi increase see worked out result show early payouts v waiting odds success v average money left end m v m high money left end m v m low money left end m v m worst case minimum number year broke v also figured maximum amount money spend year historical success early pension s well k v k situation late payment work better hit worst case scenario exhaust k b worst historical year would put year age could still end pension more k slightly inflation adjusted s k or k start age would also another pension would also pay k not inflation adjusted leaving k decreasing effective value annually pension keep inflation whereas took historically effective route early payout pension s still crapped year later age would le k s k pension k pension le k also losing value inflation would lot tougher live k k need arose although like said never scenario early withdrawal plan succeed giving k inflation adjusted,229,212,Firecalc observation on taking pension and SS early vs late
graduated college k debt immediately k nw asset took k per year job started paying loan immediately k per month rest went towards partying lost job due company buyout took another job making k per year started contributing small k then worked way company fall making k manager age burnt took job back company bought company k jan point net worth bought house sold house money crypto invested heavily k weedstocks also finally finished paying student loan june year today sitting following asset allocation k k plgix large cap growth fund indv brokerage account k u mj rest tech stock play crypto k saving k extremely heavy equity mj tech stay way estimate pas million dollar age point retire become math teacher assuming market return average next year estimate based salary increase there long bear market delay career change end world really fortunate extremely high paying job wish would started sooner graduated really investing spent way much money partying travel balance fun also need set future,70,109,First FIRE update - 27M - 146K Net Worth
dont enough retire completely thinking quitting high paying soul sucking job think enough work part time cover monthly expense get healthcare maybe throw little retirement dont really want stay field oil amp gas dying industry anyway sure type job want go looking idea,453,263,Anyone planning to work part time after meeting FIRE goal? What do you plan to do?
got raise grossing k k annually right max ira put another k employer match dollar dollar big windfall trying avoid lifestyle creep said either put toward mortgage cap retirement contribution understand argument putting market mortgage k year market give ish money sits longer make money completely understand but said mortgage paying early obviously paying interest great head gotta pretty damn nice major rush pay could take year year old without mortgage sound unreal,170,91,Maxing Retirement Accounts or Pay off more Mortgage
hit milestone today planning celebrating song list feel good i done it i got money song feel free delete comment found three similar thread past fire grinding and three downvoted oblivion song list far heavy like now jimmy buffet gentleman leisure killer man yello oh yeah barrett strong money dean martin money song,70,5,Financial Milestone Celebration songs?
month ago someone sub made post asking people fi journey dont spend time discussing investment cant find anymore recall general consensus since cant predict stock market perform isnt much discus fi path would better served spending time thing control like increasing income decreasing spending agree market one person control think is prudent spend considerable amount time optimizing portfolio given good chunk fi re usually achieved mean investment seems argument globally diversified portfolio time u outperforms world time world outperforms u many unknown make accurate prediction best buy slice everything underlying assumption equal chance one group stock outperform rest supposed buy global market weighted etf like vt think idea bit flawed unfair historically well performing subclass stock hypothetically speaking let say nasdaq qqq chance repeat last decade go zero dollar nothing between v chance vt repeat last year performance assuming risk tolerance accommodate both would choose qqq november would yielded end october vt qqq returned x much nominal dollar return so expected value hypothetical is qqq vt see expected value qqq still vastly higher even considering chance nasdaq going zero ten year time return actually declining way zero fact two outcome experiment would need chance repeat qqq chance going zero trump guaranteed return vt purely mathematical perspective wouldnt issue index u around world returned roughly amount dont large gap well performing american index like nasdaq global average seems getting bigger larger return compound time large opportunity cost come safety well diversified many feel fully taking consideration yes past result doesnt guarantee future return yes cant predict stock market mean simply default globally diversified portfolio opinion risk tolerance accommodate both make sense take calculated risk reward could great realistic example suppose think chance nasdaq return next year le quarter decade prior chance return chance return again well last year would consider pessimistic outlook compare chance vt repeating chance outperforming last decade return qqq vt still even close point nasdaq would fall really far justify holding globally diversified etf even small chance repeat enough warrant taking risk think important calculation portfolio rather simply shutting brain assuming outcome probability light past performance again only applies risk tolerance factor thought,150,5,Taking a closer look at investment returns.
tax bracket w job taxable income standard deduction max k contribution bracket go also long term capital gain income year mean get lower tax rate selling short term capital gain assuming would taxed bracket another gain short term capital gain would better deal selling long term capital gain,4,1,USA tax question about capital gains (short/long term)
im curious good way automatically transfer money certain amount bank account investment account eg betterment know automatic investing generally good idea income quite variable specific amount month wont necessarily work would like keep certain minimum amount money combined checking saving account automatically invest amount money minimum good way this thanks help,6,1,How to auto invest over a certain amount?
name cleyten im idk right sub question wondering seminar really good powerful listen learn from situation isnt special booming self employed cant seem find right behavior handle money keep spending it hope seminar manage money invest it house cash flow tip etc main problem saving kind feel like money low save spend again bad toxic habit ruin dont pick soon know im maybe starting late late better never thanks advance,3,1,Seminars audio.
recently opened roth ira watching enough youtube tiktok video havent put anything yet though high yield saving account marcus app goldman sachs keep saving deposit money every two week transfer saving money roth ira treat roth ira main saving account someone lay pro con that recommendation thinking investing money roth ira etf help beneficial thank you,15,1,Should I transfer my savings account into my Roth IRA?
hi there starting get financial independence train dont really anyone personally consult ive saved looking invest k taxable brokerage account im paw ive recently read simple path wealth jl collins decided vtsax seems play putting money next year already max k sponsored work ira year account returning around pay three year tax efficient account option lump sum particular begin research ive noticed etf may better play taxable account someone plan hold long time case deciding investing vtsax vti vti correct decision instance disadvantage vti taxable account blind to merry christmas,6,1,VTSAX or VTI with a taxable account?
,0,1,Passive Income Ideas
hospital bill kaiser los angeles point affecting credit past negotiated settlement debt collector credit card collection however creditor told way negotiate hospital bill true thank you,1,1,Paying a Hospital Bill in Collections
would like get opinion following loan estimate wanted know final cially reasonable primary residence intend live year till get stationed different place appreciate help provide,0,1,Need opions of a VA IRRRL Refinance
hello tldr wanna transfer saving roth ira financially savvy dad insists stick traditional ira right f studying c school completed internship faang company past summer used lot earnings pay school ended saving k account company provides thinking could take advantage company matching came realize matching apply intern save enough company keep account open rolled amount traditional ira internship complete thinking take money traditional ira pay tax it put roth hoping contribute roth junior senior year well switch traditional ira industry reasoning behind far lower tax bracket graduation likely retirement though know be made roughly k summer gross expect pulling least figure post graduation one faangs thus make sense want pay tax upfront pay fewer tax percentage wise point life told dad taught lot stuff finance first place rolled eye told overthinking it main argument always opt pay tax later opposed know anything option available future mainly speaking fact tax code could different assumption high tax bracket retirement may valid point living capital gain instance dunno this kind love working imagine income time retirement though year old speaking topic thought further also realized tax decrease principal whole point saving retirement early take advantage power compound interest so left wondering decreased principle counteract effect increased tax later whatever decision be probably contribute roughly account next couple summer school know sum money really significant treating decision intellectual exercise opportunity learn tax policy love hear take debate silent lurker year since parent instilled money give freedom choice something always appealing me,2,1,help settle dispute: roth vs traditional ira in niche case
advised reduce equity exposure year leading fire amp draw bond tent first year reduce risk since bond yield low recently amp cash devalued much right now structuring portfolio protect market downturn first year early retirement,15,1,"If you're planning on RE in the next 5 years, are you building a bond tent? Holding cash?"
merry christmas thinking back previous christmas knew people fighting family friend wanting money made remembered comment read sub deal that also done well gt mom would offer help anyone family offering financial advice would give complete full control finance would guarantee could help save money afford thing want problem is start saying afford that sudden need financial help anymore figure own also stopped asking money parent since help offered tightening budget instead hers giving people money really help understand money gotten given hear lot parable this like teaching someone fish giving hem fish due economic outpatient care mentioned book millionaire next door gt economic outpatient care eoc term used express affluent parent provides money adult child besides offspring observation resulting achiever wealth uaw child eoc contributing factor passing uaw belief offspring receive eoc annual income compared counterpart recipient eoc comparison also net worth eoc give recipient false sense financial security reason purchase home upscale neighborhood exceed recommended value according income thirty percent american family live home valued yet earn annual income these home demand nice car driveway nice furniture living room nice plasma tv complement furniture offspring also purchase consume eoc rather invest it dose eoc given regular basis eoc actually absorbed individual perceived annual income expenditure calculated anticipation regularly scheduled dose eoc word giving money people make le likely try own feel better short term hurt long term used give money initially curbed started giving advice on note advice though lead horse water make drink people really want tighten living situation make sacrifice see r financialindependence thread above want money free told many people basic financial advice want implement it tried convince beginning say suit yourself rich decade spent stuff honestly sure tell you suppose rare situation give money experience never ended well,284,1,"I don't give people money anymore, now I only give advice"
forgive wrong sub finally paid credit card long year working hard it checked credit score dropped pt normal goal get advice currently personal loan focusing pay asap trying buy house keep score go clearing debt,4,1,Paid off my credit cards and credit went down 30pts
hey everyone year old italy going high school currently reading kiyosakis rich dad poor dad enjoying it dad recently told amazon stock since saw ad asked work thinking invest it try familiarise it told learn enough it could invest promising stock told ad show put minimum wont gain little investment perfectly know first need financial education getting involved world want manage risk thats im asking you said could put market would nice stock thinking amzn since world digitalising people buy internet also tsla,11,1,Which stocks should I invest in as a 14 year old?
inflection point life work tech unfulfilled unmotivated year recently started job comp highest career it x offer had still unfulfillfed unmotivated also recently reached current expense fi dream getting fat would automatic stay year made decision staying unfulfilled worth hence plan quitting next month onto hard part try find career fulfill me suspect biotech would sure really want work hard it specifically mind effort education sure want work hour week ever unless something actually fulfulling motivating put mild effort toward career pivot take time getting there go all in train quickly possible abandon focus re,6,1,FIRE vs FI + Career Change?
searching job duty in sole proprietorship company skill use programming python html cs or new language finance related writing consulting niche interest me drop shipping adsense affiliate webshops ai deep learning python coding in general new trend job niche contributes to will change revolutionize world coming year maybe make job obsolete create opportunity others guess ai deep learning one niche divided many niche like hear see game changer different way thing,1,1,Searching a niche to focus on and create some value for me and others. Any business ideas?
apologize post little braggy understand many going financial hardship right due pandemic would like say happy achieved milestone reaching age came poor family single mother raising kid saw struggle went two job seeing family struggle nothing name pushed better place came rd world country hard work wasnt gonna get anywhere thankful hard work playing card right got today america also people believed me unfortunate mother doesnt see way longer speak since age homeless stayed youth center hanging around joined u military year old that too didnt work able meet wife year now down success bad mother doesnt witness success missed graduation h college successful career always told wasnt going mount anything i think pushed even further also one big reason stopped talking mother went non paid internship freshman year college yr career total making k base salary ive reached figure last year bonus ot base pay shy figure today informed pay raise bringing figure happy holiday everyone read best news gotten year financially,98,1,(28M) officially became a 6 figure salary
right auto invest set throw money every week vanguard account vtwax come annually simple think it literally want spend little time possible managing investment whatever strategy use going either something simple like use service professional zero interest investment could day to day headache me buying real estate day trading roughly retirement timeframe year slightly sooner essentially kid hopefully independent lot gain letting professional help investing accumulation phase,3,1,"I have about $150,000 annually to invest. Do I need professional investing help?"
im looking book recommendation specific im fi journey background ive already read jl collins simple path wealth john bogles little book common sense investing book great get started right fi bogle convinced merit index fund collins laid path fi broad stokes ive paid debt bought house getting k match investing u stock index fund debt paid im done saving house lot invest dont comprehensive strategy bucket put money order addition learning fi investment strategy order operation investment account id like gain literacy thing like roth conversion backdoor roth anyone book recommendation help im fi journey already addressed another thread feel free point it thanks,7,1,Book recommendations with specific and actionable investment strategies for FI
hello everyone yes know guy said self promotion hear out learned lot howard know everyone else too name logan lin started podcast back talking various business topic guest would fireside chat topic like behavioral investing capital market efficiency start hero entrepreneurship cash flow valuation private equity etc mission really help others learn something new whether high school student college student even young adult work force episode guest could take listen chance would appreciate it billionaire investor tim draper dean cornell university school business mark w nelson chair entrepreneurship duke fuquas school business jon fjeld chair marketing university michigan ross marketing program nation fred feinberg former vice president google capital current partner kkr amp co inc named forbes top venture capitalist victor chen uc berkeley haas professor torsor kotee billionaire investor howard mark link podcast spotify new episode one greatest investor world howard mark talk investing covid market risk investing link,1,1,"Finance Education Podcast. Learn about investing from one of the greatest investors himself, Howard Marks. Talks about investing in the Covid-19 markets and risk in investing."
read whole bunch thread subreddit read faq googled plan far please criticize it job offer start june annual income sign on bonus employer match roth job requires move couple state away anticipating k federal state tax calculated insurance health yet assuming mo rent util brings k k planning maxing k brings k left normal expenditure saving hopefully investment expect lot lower due health insurance stuff need look i access yet know cost looking right anything else read change plan,18,1,First job starting soon. Some questions about FIRE
personal story vacation first one year visiting family made purchase personal item cost never make purchase big past week ruined half vacation missed good bonding time family literally complete anxiety shock whether return item sell it etc spent hour time waking time sleeping thinking scenario could make back money this return happiness efficiency much affect net worth target retirement etc would wake middle night would first thing mind point felt like vomiting finally made decision keep item could always sell little loss made realize much killing analysis blessed make six figure nw k s point think realized spending month hit target saving goal made extra income year first time done something like year spent hour analyzing item really need cost lot time point bos questioned okay affecting job anyone tip dealing share similar story family actually concerned mental state,34,1,My money anxiety story - Penny pinching has really messed up my mind/psych/time - Help?
married child currently business make k yr pretax k deduction trying figure best way set everything maximize tax efficiency long term since would like semi retire move high tax state currently following house fully paid worth k mm invested market k tax advantaged account k cash rental property amp xb set solo k previously realize probably one wife well since help business occasion question following amp xb make sense add k plan company spouse try max giving larger salary added cost fica offset enough benefit putting k spousal k small child age anything them thinking trying fund much possible worry future use it always roll possible future grandchild even wife decide go back school retirement reason pitfall so trust sort worthwhile child assume get living trust avoid probate sure kind trust planning max k contribution backdoor ira greatly appreciate help look forward figuring step take thanks advance,3,1,Tax Strategies for Self Employed Moderate/Higher Net Worth/Income Family
