selftext,num_comments,score,title
posted personal finance also sorry double read you alright i sure well received want know people think banking best video seen titled method youtube whether work not scam not scam finally compare taking monthly surplus simply putting market quick background yo house but selling within month move japan wife child debt mortgage monthly spending no cc car payment quick financials checking saving vanguard ira brokerage tsp combined currently mo extra i deployed currently tsp set get back scale back like mo free feel like well would love see conversation velocity banking v investing v anything else let open up,2,1,Velocity Banking
guy think following project guap strategy fund support circulate amongst merchant network reward consumer supporting community business grassroots organization hbcus idea behind guap network which yet revealed participating black owned business accept guap coin allowing real world usage coin saved spent merchant location within network peer to peer cryptocurrency created promote economic growth wealth guap community economics building strong foundation basis long term economic wealth particularly underserved community like black amp brown community limiting service community seek exclude community however standpoint begin community greatest positive impact entire world solving economic obstacle prevent taking full advantage technical blockchain fintech innovation share point view,1,1,Improving your financial position through Guap coin
much information sure information applies since career,5,1,"I am a 19 year old student, what should I focus on?"
self promotion ie posting project business operate profit from typically practice discouraged r financialindependence post removed moderation thread rule do not apply however please post referral link thread use thread talk blog talk business ask feedback etc self promotion start leak outside thread return time self promotion post banned please use space wisely link only post removed put effort it,45,1,"Weekly Self-Promotion Thread - May 20, 2020"
please use thread discussion feel warrant new post sub rule posting question basic personal finance investing topic relaxed little bit here rule meme spam self promotion excessive rudeness politics still apply look faq subreddit posting see question frequently asked since post tend get busy consider sorting comment new instead best top see newest post,490,1,"Daily FI discussion thread - May 20, 2020"
im essential worker work liquor store closed people get withdrawal need hospital get covid according podcast listened to sale sky rocketed this friend non essential work shoe store getting paid week unemployment dollar additional payment unemployment get paid hour get buck week practically get paid practically much stay home bullshit drive work expose self covid work whats stopping showing work fireable offense getting good amount money arent essential worker getting paid heck write even looking condo buy friend made money nothing live parent bill dont gas money drive work dont pay food eat work making ridiculous amount mean im screwed im school think ill get degree year leave work get unemployment get disqualified quitting something shitty get fired qualify bulkshit essential worker getting paid right now,15,1,Venting to the amount of BS going around with this economy
student fire also want make sure enjoy fine pleasure capitalism provide im wife k net worth k annual income trying become financially independent point would need comfortable firing driving free high school car age needed finally move on recently finished purchase tesla model first happy disgusted time dare i fire breather purchase k vehicle plenty honda fit go around needed way justify purchase busted handy dandy fire calculator conservative stock market wage assumption net worth would m year gone honda fit like beast using assumption net worth m tesla doesnt seem bad looking context ashamed purchase still consider fire guy mean dont need frugal frank fire up,11,1,"Buying a Tesla Model 3, and it’s not a mistake!"
age left corporate gig sr director large cpg company midwest salary average bonus good stock option grant vesting grant roughly k year stock price time high operation area plant management supply chain project management stuff year company managed job reduction received package package week pay vacation also picked unemployment week that worth k leave plan executed perfectly took month planning conversation decent timing backdrop big company always looking cost reduction project able add larger project somewhere year knowing everyone made somewhat easy also role could eliminated without major reorganization responsibility mm liquid mm k ira k deferred income payable year roughly k year mm wife health insurance family make k part time role kid oldest kid getting college total college anticipated cost accounted for good return would add rd kid college basically needed k k type this still k short year need first installment rd child lesson learned particular order count friend time work week thought would able grab beer mid week one buddy work week never really worked guy working week kid never much time week exercise time yea true worked lot left job outside never missing workout workout get healthier work le stress yea le stressful find way get stressed however win question positive surprise spent time kid good also feel like enjoyed day week enjoy friend little more back work owner operator k revenue small business retired month bought partnership small business work company big growth opportunity make k year little stressful though dealing unwinding contractor business legal stuff watching customer see stay u sure long stay business least another year like much considering work right now probably sell share another k so ask anything glad share experience,377,1,"Retired 26 months ago, lessons learned and ama"
retire year stick government job receive pension mo full healthcare coverage problem job quite boring unfulfilling debt free single kid decent home live run k k income k mo net income emergency fund k just finished funding long term saving mo contribution cd k from inheritance k k mo contribution b mo contribution roth ira k mo traditional ira k rolled previous job brokerage account k mo contribution vtsax expense rent mo bill utility mo grocery gas misc mo donation mo thanks,6,1,FIRE in 9 years (or less) or save for a house?
year old software engineer recently able start saving retirement loan however dual u mexican citizen also studied abroad japan college gotten taste life outside u frankly want more however everyone know software engineer salary u tech hub best world so focused getting fully remote job okay salary low k seattle bay area moved beach resort mexico small city countryside japan working remotely reduction cost living would equivelent getting famous k salary bay area living much exotic interesting place lifestyle imo better fit me see challenge would visa japan but mexico number seem check out anyone else fired digital nomad lifestyle,67,1,Living abroad while working remotely to FIRE?
got personal finance order later life got started fire path early s stick government job saving plan retire year age monthly pension fully covered healthcare benefit well saving retirement brokerage account problem job suck quite boring single kid finally debt free left inheritance k live sacramento decent condo townhome house run k k love apartment location rent quite low landlord never raised rent said mind new place stand pay rent though would need save least k k downpayment plus closing cost order affordable monthly mortgage including property tax hoa etc feel like matter hard try take forever get place own sure save aggressively house may take year save brokerage account money retirement thing keeping current city job info income k mo net income state job reduced july due state deficit in year receive pension mo well full healthcare coverage saving emergency fund k just finished funding long term house saving mo contribution k inheritance k k mo pre tax i know low please remind me b mo pre tax roth ira k mo post tax traditional ira k this b rolled rom previous job vanguard brokerage account vtsax k mo contribution post tax expense rent mo bill utility mo grocery gas misc mo donation mo worth buying house would like change current apartment rent area gone incredibly im afraid wont find great deal,3,1,Save for a home in CA or rent and save more for retirement?
hi all employer make generous contribution profit sharing plan behalf employee total compensation grateful for based conversation management research matter employee contribution possible however anyone knowledge insight profit sharing plan would preferable employer than say offering k plan employee could also contribute annual limit perspective would better management make contribution k plan employee could also contribute must missing something here thanks,6,1,"Employer Offers Profit Sharing Plan Rather Than 401(k), which Prevents Employee Contributions"
completely fire related guy might sharing kind mindset figured post here unemployed since month quit old job made mental life miserable hated going there good worker boss treated u like dirt let u know replaceable useless feel much better now lived combination saving dividend income since then need lot money never needed thing make feel good need freedom mental freedom time time send application offered job would pay fantastic much last know come charasteristic employee position doe denied really know time figured feel inner urge sign paper matter much money mean somehow money justifiy loss personal freedom anymore low saving forced get back work end see achieve financial freedom real story this wanted write this,2,0,Why did i refuse a high paying job offer ?
better part year lurking taking subreddit lesson towards making small improvement and wife financial discipline situation made real small time progress proud u constantly struggled grow saving account something wipe out yo yo month emergency fund process constantly making progress debt overall forward motion flash forward today due sad reality covid america furloughed hour cut half drawing unemployment since furlough began first time ever life got first unemployment deposit today due care act making significantly income situation working result banking lot extra cash for u today surpassed largest amount ever saved previously held amount saved wedding sitting close month worth emergency fund current bill period already completely solvent expecting additional payment week o feel strange wife feel guilty without bit guilt also one look gift horse mouth setting family come pandemic stronger ever before grateful everyday healthy able stay solvent time wish more grateful can pleased punch brought u here going celebrate silver lining same life gave u lemonade try pay forward extending good fortune friend family lucky some still holding first check week know lot folk struggling various reason pay bill stay sane keep food house much take care make sure neighbor pay rent bill get eat still get make incredible progress towards stronger financial situation know future hold still early stage financial growth learned lot spending time sub careful touch k like even though contribute much would like yet plan hit month dollar mark aggressively pay debt depending long situation go on may even able start investigating whether should will purchase first home done without motivation sub given me know ever achieve financial independence get retire early feel optimistic probably allowed given pandemic got chance thank you,46,1,Small Hurdle Celebration - Unfortunate Circumstances
started investing money stock market ive seen mainly ups course thing like covid opec china trade talk impact gain overall theyve going made yesterday currently job work remotely home plan get another conventional job soon question is lagging behind order achieve fi current state want get early possible willing put much extra work needed get there,18,0,"I’m 17 and have $13,000 of my own money invested in the stock market. Am I ahead of the curve or lagging behind?"
learn save invest track decentralized finance defi asset using r zerion simple interface,2,0,How to Create a DeFi Portfolio [Tutorial]
long time viewer first time poster finished undergrad heading grad school next fall two year get mba fortunate enough know leave grad school two year without student loan debt scholarship help parent working school however interested fire community year decided want develop hard and fast plan summer future past would always put paycheck saving account earning month robinhood share vanguard s amp p the robinhood moreso practice develop good habit etc need help adjust future goal fire feel comfortable amount saving post grad school change paycheck strategy grad school term much go saving account much go robinhood use platform robinhood get different index fund thanks all community always extremely helpful look forward continuing using guy help future,22,5,"22 year old about to go get my MBA, need a saving strategy for the next two years."
backstory im first generation american born nyc living ever since come blue collar family drilled early age go college finish degree following advice parent enrolled college always felt like wasnt me ultimately decided pick job plumber helper semester sophomore year havent looked back since since then ive lucky enough continue parent build little nest egg almost year mark working full time roth ira taxable brokerage high yield saving account im currently schwab etf bond although decent nest egg year old beginning worry future dream always run construction company goal eventually attain master plumber license however main concern nyc becoming increasingly unaffordable example parent purchased house full rehab inside year ago house worth m house neighborhood and entire city drastically appreciated point seems impossible blue collar worker like purchase one did would lifetime financial burden im fortunate enough good relationship family dont want live forever renting apartment would spending way monthly take home pay rent including grocery bill etc absolutely love trade plumbing dont plan switching im worried city continue price fire grasp tradesman woman community could share advice maybe consider moving affordable city plumbing high demand im sure go out,44,1,Is FIRE feasible for me? (Blue collar NYC)
deal turned le name original plan start ecommerce brand funded due covid plan foiled still lot drive willing work hard meantime learning direct response marketing advertising anyone idea make decent money week relatively quickly,6,1,I need your advice.
would personally argument that going continue investing long term link comment say,3,1,"Does it make sense to continue investing, or is it better to keep the money for now?"
early work tech consulting making k gf brings k hoping get married next month working small saved k retirement k e fund another k taxable portfolio honestly like job nothing c degree think ba management work ppt slide etc actively searching job since virus hit put everything halt point though touch degree even know land another job since finding fire wanted save much retire somewhere also considering getting real estate investing drop market next year honestly anything supplement income outside career,8,1,After finding out about FIRE I've want nothing more than to already be FI and I've only just begun my career.
hello recently turned decided want invest self education buying book purchased rich dad poor dad enthralled effectiveness however wondering would guy suggestion book the main category would stock personal finance real estate im ireland aswell help suggesting certain book thanks advance,0,1,What is the best books to help me get a head start?
recently listened podcast spurred looking additional income idea move fire date forward brief instead slow steady way saving m get retirement income k using sw method side hustle continually generated something like k per year would lower amount needed retire k in addition would give hobby retirement side hustle idea could generate kind ongoing income retirement,11,1,Side Hustles and speeding up FIRE dates
small business owner k maintenance expense next year right money sitting capone saving account interested know guy would keep it also slight chance catastrophic mechanical failure could cause need sooner saving account money market vanguard mm fund bitcoin sure relevant currently maxing ira solo k anything left going taxable account,2,1,Small business savings
hi everyone long story short believe one conceivable path achieve fi age age situation year old aa degree computer programming b political science i also several certification keep current never tried get industry work probation officer southern state k year get k year annual salary increase max k held job since age state wide pension system qualify enhanced law enforcement public safety pension qualify enhanced pension fact got young take early retirement age draw month wait age draw month also qualify retiree health insurance well pension system report currently funded independent audit rate extremely strong believe year part want go change industry get it but feel sunk much time probation officer job point real basically guaranteed path fire stay current job retirement basically achieve fi age age possible could full fire age would pretty risky problem however meantime make pretty low salary basically stay low entire career live pretty minimalist lifestyle due low salary zero debt due lifestyle i mean literally debt kind also inherit k paid house parent point future so question stay ride pension gamble everything try get another field could potentially make much higher salary eventually appreciate advice,15,1,Is this my only path to achieve FI by age 50 and RE by age 55?
try search couldnt find good answer want start investing retirement plan asap best ira roth dont like idea k fluctuates value hard move around change job etc thank answer,6,1,Best IRA ROTH to invest in?
say saved large sum money retirement account getting married interest growth principle considered earnings marriage considered earnings prior marriage a principal invested marriage,2,1,Prenup and FI
im currently yr age currently holding voo vxus taxable account vanguard im currently considering opening roth ira account dont really know put it thinking dividend etf maybe like spyd vym etc one day retire live dividend income good idea strategy invest another growth etf like vti small cap etf like vb,4,1,Best investments for Roth IRA?
mixture cash investment etc graduated year half ago amp xb ama,15,1,Just hit 100k Net worth (23M) !! AMA
saw video covering ford stock dollar day ago moving higher fast think get back around pretty easily next month two seems likely based technical think,2,1,Ford Stock Analysis + $F Stock Price Prediction In 2020!?
bit background me married current work field recently got credit card debt k number please let know order save fi salary tax insurance investment k k stock k saving account marcus monthly expense one bedroom brooklyn ny family assistant sending overseas food k path transportation subway transportation two cell phone line internet service hulu electricity gas service get left thinking allocating every month blue chip stock rest want put saving account reach emergency fund that keep saving payment house willing rent out real estate investment please tell cut number good age p reason wife working bc waiting work authorization,15,1,Please tell me if numbers are good;
seem like many hardly really roboinvestor service getting ready start making withdrawls retirement account anyone using roboinvestor yet looked it,1,1,roboinvestor for IRA withdrawls?
hey everyone first time posting sorry right place ask live nyc friend f bad situation work joint account parent parent usually end using money save herself shes want able save future without going waste week parent decide use money thought might able create secret account one online statement spoke td bank it td bank said although statement would online would still send offer credit card address listed account way stop that feel lost help friend safe space store money earns anyone know bank nyc area would willing create secret account with bank upon request stop sending mail including limited credit card offer statement really thought td bank would something like apparently don thank reading help,22,1,Escaping a financially abusive situation
disregard possibility convinced dissolved time way calculate make invalid source income retire early thank,28,1,How do you plan for potential Social Security income when calculating your FIRE number?
fire date got drastically pushed forward much considering quitting summer rehearsing talk quite time havent quite settled go it folk made move already handled it dont necessarily want say im retiring im id rather try explain field question going keep you etc id like honest dont want reveal financial situation,410,1,How did your FIRE talk go when you left work?
hr acceptable wage start living independently,4,1,Is $21/hr a living wage
year hard work finally paid student loan today im freeeeee now feel nice begin living debt free,10,1,Paid off my student loans today!
please use thread post milestone humblebrags status update feel warrant new post sub rule posting question basic personal finance investing topic relaxed little bit here rule meme spam self promotion excessive rudeness politics still apply since post tend get busy consider sorting comment new instead best top see newest post,72,1,"Weekly FI Monday Milestone thread - May 18, 2020"
retiring stable country protects freedom,5,1,Has the tyrannical response to the Chinese flu hoax made you reconsider FIRE in the US?
need help applying broader fire principle situation you post detailed personal case study ask many question like help others whove done same sure question pertain post anywayyou might surprised itll helpful use suggested format simply copy paste fill in etc since everybodys situation different feel free tailor layout need introduce age industry location general goal target fire age amount withdrawal rate location educational background plan career situation plan current future income breakdown including one time event budget breakdown asset breakdown including home car etc debt breakdown health concern family current situation future plan special need elderly parent other info question,122,1,"Weekly “Help Me FIRE!” thread. Post your detailed information for highly specific advice. - May 18, 2020"
enough money almost anything worry about,51,1,What do rich people worry about?
never pay full price life motto built something would negate this research tool could help track deal earn reward unable find something liked took matter hand working shopping reward site hippidy full year now putting countless hour hard work dedication effort reward people missing best price hope save lot people money lesson learned stay motivated focused goal time life get feel like quitting stick it hard work put pay off proud sticking launching site big life accomplishment,0,1,I ended up building a site to help me be a smarter frugal person - Lessons learned.
first all know covid traveling barely option speak non pandemic context love idea perpetual travel slow travel permatravel whatever want call it moving monthly perhaps annually semi annually different city country continent year old single american man grew moving often dad job think appeal me love someone experience life style answer question feel like amp xb age nw relationship status perpetual travel lifestyle live thought get old often moving stay occupied best worst part anything think realizing now deal perpetual nostalgia one hit every time move miss previous place nostalgia compound life collected place lived get sense hard often go home visit friend family general tip thing want add,61,1,"All the FIREE's who are doing the permatravel/perpetual travel, I have questions!"
knowing yours better expectation figuring situation would look like appreciated,8,1,"How much money do you all live on now, expect to live on when retired and what are your expenses?"
aloha greeting chicago il year old college dropout here wondering ya ever set form protection asset real estate stock bond big fat golden goose egg really believe protection maybe showing u newbie you would it start if believe protection worth time money saved past reason asking simply trust issue tend overthink lot worst case scenario almost i messed up kid know laugh butt off fear people money future whether crazy mother in law fake gold digging friend people back high school want sue finding got rich etc etc also mean wealthy atm born silver spoon more like plastic spoon half chewed cracked half plan place reach surpass fire coming year post question mind while tl dr would suggest setting sort llc corp starting invest market so baby step would recommend start with stuff google talk certain type lawyer etc amp xb thank help,6,1,I'm 22 and Single - Should I Build a LLC or S-Corp to Protect Myself Against Unforeseen Shenanigans?
tax today came across excess ira contribution seen past big question unable max roth contribution could even take penalty i believe reason ask always like max roth year would take hit could add bit hit max contribution thanks,2,1,Excess IRA Contributions?
say million bank uk insure k per account put money one bank know invest money investment also risk lose m,13,1,How not to lose money?
