,index,selftext,num_comments,score,title
34,78,applying bunch full time job currently brace month go dentist chronic issue requires go doctor week foreseeable future evidently make good impression employer supposed work full time job go appointment well,2,2,How can I go to the dentist/doctor/whatever if I have to work a full time job?
78,219,someone used clean every three month hopefully let tell better feel live clean apartment seriously help emotional state make thing smell amazing without air freshener worth time keep thing clean monica gueller clean said tip wash dish every day must keep thing smelling nice cluttered take minute let dish accumulate miss day wash next morning clean kitchen countertop every day important dish take minute basically keep kitchen clean lot bad smell come keep clean another thing every day make bed bed take lot space made large surface area clutter sleep better trust use never make bed clean bathroom week every two week let bathroom disgusting best way clean regularly floor amazing dust hair accumulated floor cat clean else kitty litter everywhere good cleaning make thing feel smell better lastly either put item away immediately pick clutter every couple day live small studio room clutter sometimes lazy sometimes leave clothes floor bathroom desk chair grad school book everywhere always every day put everything away really help make thing feel better use never clean wonder thing smelt funny curse tripped pile crap even though find everything needed apartment feel home keeping clean apartment home sanctuary study room,3,1,Feels Like Home
167,370,want know start mature money going try backstory way basically feel skip whole normal teenage year work spend money normal stuff want worry think hard spend save wisely position feel live way make sense still living home work full time know move parent mostly dad growing want milk living free long possible matter toxic environment know move realized probably figure truck pay serviced replace long story short dad bought truck year ago older brother used sure regular maintenance passed three year dont think dad ever work done oil change nothing rarely drove recently online school need leave house moved seattle bit bring drive every day work scared serviced know probably shit ton wrong going back wanna spend money fun mentality dont want put money toyota tacoma prerunner mile feel run great broken ever scared day fast approaching considering trying buy used tacoma wd snow little truck cant handle lot money want fun long burdened poor mental illness secluded world survive dealt abuse others brain free responsibility full time job make mental health worse real escape right expensive hobby scuba diving planning buying gear couple day getting good bonus friday torn responsible treating real quick make next couple month somewhat bearable saving wise roughly opportunity make rather large bonus every month work best company though last month getting bonus friday dont know yet estimate around month depending well associate goal around christmas time called super stretch people walked bonus opportunity make quite bit cant operate full power every day make revert back suicidal thought escape motivation hard best hence desire spend money pursuit happiness need help sorry formatting spelling error phone correct actual word nonsense,3,3,Budgeting and being responsible with money?
178,389,need help car insurance f decided wait graduated college license caus ei lived campus worked walking distance campus passed driver test three day ago yay due loan terrible credit live sister insurance family insurance work full time job rent bill take basically money nothing save car insurance long story short please help car insurance advice,2,1,Car insurance
297,571,piece item bought make feel old,1,4,I just bought a Binder! I never felt this old.
324,600,keep getting virus pop every time click link page come,4,2,I think my computer has a virus. I don’t know what to do.
332,611,weird question kinda gross know sorry hope isnt ridiculous thing thats ever posted related adulting challenge promise general noticed piss people around seem le everywhere go drink water pretty constantly really depressed otherwise mental health precarious delicate piss every hour worthy trade however started first full time job field see becoming issue soon ive lucky previous job enough leeway use restroom le whenever college really issue leave room lecture group work power dynamic isnt strong embarrass people life routine pretty quickly new job fairly high stake bos colleague feel way another walking theyre middle sentence home lot partner ill piss sometimes dont take dime keep hydrated without run room dog fire hydrant every hour secret piss time dont adult skill didnt ever learn iron bladder need resolve dehydrated feel shitty handle true situation pretty blessed otherwise cant complain,38,112,How do you stay hydrated without having to piss constantly?
390,691,posted couple month ago still struggling mom overly concerned life even though moved ok extent ignoring complained self imposed stress christmas big point contention thats causing fight continuing dog sit stepdad travel tried say moved wanted dog sit weekend didnt work full time job job minute away lived home moving still made commute half hour want doesnt feel comfortable boarding dog say attacked flea another illness feel another dog sitter rob house trust nobody problem number said pay week think great reason want keep dog sitting part doesnt want give travel lot moved need show gratitude pay back stepdad dont give answer essentially happy watch dog furious main reasoning dont want spend week away bed kitchen convenient work schedule whereas think week big deal especially paying compromise gave march cruise told cancel weekend trip planned back going trip matter unless organizing company cancel march probably stuck cruise paid canceling cause lose close mom stepdad another cruise planned october january fully paid right hoping day wake realizes house cant dog anymore refused even consider feel point dont see friend asked stay parent house parent travel friend enjoy nice vacation home apartment seems every adult boundary parent parent respect boundary seem happening,2,1,Still failing to set boundaries with my parents. Does this get any better?
439,754,living home mum bf boyfriend living u coronavirus lockdown march got together start year used home lover thinking wasnt moving year especially love space chilling room ive seriously loved every second bf living dont want move back home matter time due coronavirus settling genuinely think id happy flat full time job fact job work together correctly furlough entire time although afford small flat concerned serious financial responsibility dont currently wont able money spend holiday general fun thing current job career way earning money go holiday enjoy life said wait couple year working towards career proper job flat deal moving back home,2,1,When do I move out?
464,789,got fired first full time job college almost communication prior led believe thin ice today fired someone company ive never spoken almost explanation never heard anyone department wanted argue merit thought decision honestly feel shouldnt fired kept mouth shut polite whole way feel total screw ive able tell past hour good employee good people dont fired loss think next new mind fired bad blemish resume anything possibly confused hurt happened today idk looking place vent little thought advice experienced people appreciated,11,1,I got fired today and I feel like a total disappointment. Not sure how to proceed from here
476,803,seems epic able walk around underwear put music middle night year old live expensive city world id move crappy drug addict area able afford pay rent crappy basement suite seems amazing parent asking question time love living seems amazing think already got summer job last year plan part time job finishing last year high school earning hour graduate id able afford move rent costing around id full time job minimum wage id expect around month leave left course cant know exact amount money ill ill even able find job try stupid,4,1,I wanna move out and I barely have any money right now. Is my plan to move out in the next 1-2 years stupid?
509,843,ive school long remember finally able land full time job making good pay life lived paycheck paycheck everything going rent whatever little left blew clothes makeup steady income money kind person spend eventually want house love travel idea,4,1,What do I do with my money?
626,1052,ended rant go nothing year old female graduated undergrad month ago saving federal student loan eight week ago began first real salaried position making tax side hustle make anywhere dollar monthly first began full time job high hope however seems position mostly involves secretarial work offer possibility teaching skill utilized another role try good attitude feel stressed bored time currently idea well despite request meeting manager provided feedback regarding work high turnover position notorious poor possibility growth within firm position requires hour work per week chinese overtime schedule meaning every hour work make half regular hourly rate come work required hour week make tax top weekly pay incredibly thankful getting regular paycheck schedule provides little ability apply job develop skill connection living home working job feel gotten worked stagnant pattern past two month need make radical change surroundings order actually gain momentum job search however terrified possibility may job month month decision end financial ruin part feel spoiled baby even disliking job regular paycheck financially sustainable option far stay working however half hyper aware option opportunity letting pas working hour menial labor brat simply result quarter life crisis importantly even afford quit job,10,9,Eight weeks into first salaried job - I want to quit!
640,1071,high paying full time job sleep tech havent even moved parent house year yet almost done paying first car ive living rough apartment boyfriend place definitely seen better time bedroom issue two kid place year old rescue dog fat cat u put egg basket applying bedroom right next work well got november th victoriously moving something proud live decorate call,3,22,Apartment Victory
717,1202,long story short moved parent turned got full time job great little felt slipping really dark place life started drinking lot know drinking felt excessive started smoking pot lot every day high even going work little happier guess started cutting people cause ashamed id become gained little weight though wasnt really bothered anyway decided move back parent year later feel tiny bit better cant help feel pathetic kind ive failed real life ill end pathetic circle rest life anyone know feeling really fucking pathetic really trying adult damn easy,6,5,Moving back in with parents
732,1228,moving apartment friend roomie end year rent going splitting sure utility going something pay yet know gonna pay least rent food internet gas want online education thought finding part time job instead going full time job extra free time find matter long look part time salary viable split rent expense trying research average monthly fee everything need take account literally even guess solid figure bass part time job guessing make minimum wage h hour week average rent around solid figure know asking better image cost might minimum wage part time job salary support sorry dumb question sp,3,5,Salary Help. (Alongside moving out)
765,1345,hey haapppy sunday try keep short sweet recently got full time job childcare enjoying field last job scheduled either part time full day hour lunch allowed little time recent job work difficult class able keep energy home decompress boyfriend live together often talk work four hour home go bed relaxation thing love boyfriend introvert together drain however found end many day though need time mostly fine good independent guy feeling little swept carpet lately good really chatting half hour lunch making friend staff home mentioned need time want give emotional scrap end day though mostly adjusting juggle full time job relationship well hope appropriate sub post thanks,5,4,(24f) Introvert juggling both full time work and relationship?
768,1349,away week mom took fall fine btw spouse working full time job directing community theater musical house mess writing organize work load helpful advice getting done monday outside mow lawn trim needed kitchen laundry room fold basket laundry wash clothes trip wash clothes spouse clean counter top dryer wash dish take recycling clean mircowave clean fridge sweep mop tv room put movie away dust tv stand tv remove takeaway container bag remove item belong room hoover living room go mail toss junk mail pay bill ect organized stuff gaming table remove item floor dust surface hoover bedroom put away clothes basket store season clothing strip bed wash sheet remake bed clean bedding sweep needed bathroom sweep mop clean loo clean sink clean tub ugh help,2,8,Overwhelmed by adulting
788,1387,fair amount saved definitely ish month worth saving plus month checking full time job consistent enough substitute teacher paid weekly even worked full time salaried though always feel spending money dont buy bigger thing even though money within income buy anything food coffee feel spending anyone else feel way budgeting well living luxuriously mean always little anxious finance making set budget make worse,5,6,Does anyone else constantly feel like you’re spending more than you have?
828,1447,got swifer wetjet work yesterday actually clean dirt floor instead pushing around old mop plus lady building stealing mop forgetting return lock night matter anymore gf got approved apartment first time ever qualified place without co signer older roommate qualified couple week away probationary period job mean pto health care first full time job graduating college may even though pay lot still really enjoy going order first ever check book bank account started teen checking never bothered check even upgrading account feel strange sense pride point life need check book,6,8,"Things that made me unreasonably, ridiculously excited this week"
939,1604,ive working full time job year week vacation time per year recently decided downgrade part time job go back school full time ace class working cna nursing facility xb thing want travel thanksgiving break winter break summer time know unpaid part time work last time worked part time retail didnt vacation request time leave xb question ask time whenever want want travel week time want go country summer put week notice leave appropriate hard time finding another job return leaving job xb end goal gain patient experience applying pa school year dont want cna forever merely stepping stone,2,3,How do part time jobs work with vacations? Leaving part time jobs prematurely?
1006,1688,last couple year f feeling dont want older dont want responsibility dont want house job kid debt getting old feel wasting life time washing away every day look older mirror look back life ive done everyone else got degree got full time job independent boyfriend two dog always think back mind life working looking way unwind enjoy without real purpose existing sure portraying feeling dissatisfaction correctly english isnt first language people love life dull pointless haha really trying frustrated life adult feel college ive year current job make fair money society tell whats big deal cope focus feel satisfied life make life enough,51,1,How to cope with Adulting?
1093,1817,sorry isnt right sub isnt please point right direction husband planning merge bank account joint bank account trying find new bank currently use respective hometown longer live completely clueless look bank account type credit card even interest pls help mean anything buying house foreseeable future full time job graduate student probably moving around country research know need national chain bank,1,2,"Just married, banking help? (trying to adult)"
1141,1887,newly first year full time job first relationship going extremely well moved adulting year expected think rocking however felt totally overwhelmed feel carrying something heavy exhausted told sleep walk talk almost every night getting quality sleep diet thrown exercising exhausted work suffering first put antidepressant age remember knowing depression wa described able feel feeling anymore antidepressant mostly two year ago got medication three felt shit able handle shot felt amazing long time med changed personality liked idea organic self said hard time lately decided back old med worked best wellbutrin mg day feel amazing feel table dance caught email neglected work cleaned apartment feel lamp someone plugged wall feel bit failure feel weak handle life organically disappointed feel handle life pathetic adult feel,6,1,I need medication to feel okay.
1183,1944,hey reddit want advice f serious relationship year month single almost year unhappy point cheated lowest point ended breaking without telling happened alright tricky recently wanting back dating unhappy previous relationship see past live enjoy content single life envious people relationship prevent jealousy,5,1,I always want what I can't have.
1205,1977,hey guy friend trying find temporary month place live summer mid may end july need move job ha trying move family house covid rushed back space taking online course first half summer full time job second half working remotely space work needed place live starting august need something summer idea might able look temporary housing short notice airbnb seemed kinda pricey right looking extended stay hotel,1,2,Temporary living
1215,1990,listen man sick living home turning soon inkling telling stay living parent longer ill stuck full time job doesnt make hoped student loan lot pal tell move costing sanity making insane thinking shithole ill realistic way getting place job state move know job market battlefield think moved without saving account,48,1,How the hell do people do it?
1228,2012,hey received link movie theater employer apply receive rogers grant wanted know qualify time type movie theater employee reason asking worked movie theater last five year employed ever full time job working theater part time think apply grant,1,1,Any movie theater employees here?
1260,2063,turning year going legal sort scary know lot financial thing prepare future especially college debt getting part full time job suggestion thing regarding finance anything security etc turn legal,8,1,things to do when you turn 18?
1361,2210,annual percentage rate mean want ok ne full time job wanting build credit probably use card want know actually help,2,1,What the hell is an APR
1379,2234,wife decided u need start working second job make end meet work full time job work schedule arent week week shes currently going back school likely starting second job dont bring ton money per week know thing uber eatstreet serving bartending curious see common job flexible hour week week,10,1,Looking for recommendations for a PT 2nd job for someone with a FT job without a set schedule
1430,2296,hello background looking buy house time graduate start full time job january clue begin read enough payment house heard older friend put fine opinion little bit le realistic save house take month year maximum saving towards house aside specific really need realtor credit card year half maintained good credit help especially given able buy house basically another year appreciate advice link reference resource help thank advance,2,5,References for buying a house
1510,2416,nobody told hard balancing full time job going college paying rent several bill social life lol something go decided time change dark house,3,1,Juggling act
1529,2440,try brief summarizing financial situation parent parent make budget dad want never actually mom want dad calculated monthly expense house month lot even necessary includes stuff fast food tobacco probably little car payment car paid broke got new dad work weekend mom work weekday babysitting family make family barely asks another job sometimes weekend pay better often full time job make parent combined make month make month two expensive hobby gaming figure skating put money saving made hard fast rule saving mine mine alone initially calculated give per month cover expense abandoned idea went back waiting last minute springing need money made checking account still connected mom account money whenever requested least assigned bill electric phone internet something consistency rejected idea dad even sometimes accuses contributing consistent accord spring time parent demanded money saving said getting paid next day put back gave gave point told saving demanded give anyway kept ledger money took really tell contribute furthermore parent tell money ask bill drop bucket compared pay even living roommate roommate extremely unreliable leave asked people work said amount agreed right spring need money consistently ask time month apartment bill someone even told using money feel true try live deal afraid parent might right even living roommate even splitting rent decent apartment rent per month cost way month grocery whatnot might moot point even friend real life ask roommate right know find roommate though load college student probably plenty people looking roommate issue transportation know drive parent either wanted teach though mom occasionally bringing taking empty parking lot brother teach city bus go work even drop anywhere within walking distance still walk mile know night want leave job pay well great lead future career planning vocational career welding carpentry trying save enough take welding class tl dr financially irresponsible parent ask money inconsistently consistent amount per month feel expense might lower living house roommate however know roommate candidate furthermore parent trying dissuade telling take year money live first step take getting place,7,1,Don't think I'm getting a good deal living with my parents financially. Now what?
1542,2462,inherited lot anxiety spending mom grew poor rural area even though family always middle upper middle class thanks dad job always complained price anything brother needed made really scared ask anything stressed whenever anybody spends money always odd job lasted summer month throughout high school college mindset always save possible didnt know id working next full time job pay enough save lot splurge little significant student loan payment month however feel paralyzed spending money socialize new friend even know fine budget wise something inside panic purchase maybe ill need money later spend something ill spend hour thinking else bought find getting really upset someone spends money know people treating others ruin begging let pay know wont reciprocate later want clear head hate every time spend dollar,6,1,How to get over severe money anxiety?
1546,2470,finally feel adult take care shit good full time job car pay bill time good health insurance brush floss twice sometimes three time day finally good relationship family dont hide old acquaintance see street know want romance friendship figured boundary drink alcohol without embarrassing even solid skincare routine gym membership use thing holding back debt moved lovely expensive adult home relative living room live cheaply possible pay fucking debt asap sick didnt work college till held back forever student loan leaving twin size day bed till debt gone figure take year live frugally side hustle say tired want already bottom ladder many way starting pay debt starting see someone new living relative save money starting put degree use work field passion learn adapt dont even know put underwear moment baaaarely getting hang professional field dont know want live want debt payed still unsure person seeing greatest secret psychopath lot handle feel positive want fast forward month please ugh,0,1,Starting to get tired and impatient while chipping away at the adulting block...
1594,2571,god load change work background teaching assistant mdsa special need school mergering try cut cost part mdsa work fair amount supply work around hr week currently saying looking hire someone cover supply full time job secondly looking increasingly likely putting place extended day programme work work school club three hr seems know happen rumour saying likely run multiple different club thirdly covering two day week secondary class loving dont know lady back shes due day likely lose pound ouch everyone deal kinda uncertainty,0,1,Dealing with change
1735,2841,anyone else feel losing friend hard time keeping existing friend live partner home manage plus full time job friend really seem understand situation take hour time grab cup coffee rather spend money time binge drinking weeknight keep feel lonely friend talk unreasonable,4,60,Keeping friends
