,index,selftext,num_comments,score,title
3515,5257,f finally thought life starting make sense got hired three week ago real estate agency receptionist secret first real full time job finishing college bos told chose rather another woman experienced loved interview lottttt learn wouldnt even call receptionist afternoon pulled aside basically told contract terminated effective immediately wasnt person interview nonchalant didnt seem motivated furthest truth asked meant gave pretty bad excuse bad still dont understand happened shock job ive boss good thing say even sent mother email last day praising teenager trying brag ive cried tear still confused older sister told younger went exact thing working type company feel useless lost sorry venting need moral support,78,225,i got fired...
3548,5295,hey guy first full time job feel losing mind understand people stay sane le happy working many hour week feel time left anything time gotten work prepared next day guy manage side note incredibly lonely technically two coworkers bos opposite shift small establishment guy manage keep getting lonely time spent thing alone,6,12,First full time job - crunched and lonely
3575,5330,never credit card pay stuff usually pay stuff cash debit card paypal gift card prepaid credit card rare occasion use parent credit card stuff pay way paying back cash thinking getting first credit card looking online shopping future hear credit card secure payment method instead paypal independence parent guess wondering guy think best time someone credit card never owned kind card pitfall avoid aware full time job think able pay bill problem heard case people pretty bad problem card getting debt paying lot money stupid fee want avoid,7,2,When and why should a person get a credit card?
3590,5347,fiancee moved colorado back virginia stillbirth still unemployed job glazer union decent credit keep getting straight ignored potential rental location know employed credit xb feel holding back best apply without trouble lived lease xb feel limited hard approved employed credit despite previously good job felony year ago maintained good record xb lost hope year awful left living parent better job opportunity everything fell housing homeless work full time job looking house day day xb advice help point really think better without,2,3,Living in a house when you're not on the lease?
3633,5399,f uni student uk basically rent place move want stay mum save mad year sorry bit rambly last year committed relationship girl basically spent time parent house rest time mum house road many time stress happiness chaotic feel settled due stuff relationship didnt feel able spend time technical home man life across town split time fairly equally house parent worked okay lot happier cope daily travelling got house good chance getting full time job alongside day uni include extremely long shift possibly overnights well whole thing stressing max feel homeless split house constantly real emotional physical base either house chance real routine feel outsider wherever knowing stress spending long amount time place mum bf uni class work terrified cope moving around split cleanly half place live looked renting town afford full time job leave room save mortgage really understand issue renting place year saving slowly older sister made feel making terrible stupid rash decision option putting spent rent bill saving getting mortgage couple year toss immediate happiness stress furthering adult life road feel renting asap give base operation need feel settled regrouped day mean boyfriend focus mortgage saving stayed paid le parent together long run intended afford without genuinely sure well cope feeling stressed unhappy current arrangement work thrown yes easily spend le time boyfriend parent house even home majority time feel outsider belong simply home whole young adult life yes saving mortgage well renting slowly renting tldr extremely messed routine even harder work sensible happiness renting asap outweigh investment working towards mortgage,2,1,To rent or to mortgage?
3672,5450,ive trying super hard find full time job insurance another topic another time art degree luck freelance two part time luck mom insurance month recently found need necessary surgery dont think able said surgery time due waiting rely medi cal find full time job worker kaiser told medi cal based income individual told based house hold problem based household absolutely screwed live mom sister bf grandma mom make lot money support financially pay fair share rent buy food utility yes live dependent ever except insurance guess zero help make lot money think really household income screwed anyone self guy said house hold really need surgery assuming people roommate screwed essentially room mate situation even though happens mom mean someone need go medical cant qualify roommate income count well,2,2,Question relating to medi-cal qualifications.
3682,5463,graduated working lab position summer professor month meaning loose objective complete end august real guidance structure time mean easily distracted work tip stay productive stuff done place go online work building useful skill tangentially relevant work make feel le guilty wasting time collecting paycheck xb note yes put phone silent problem distracted mostly email linkedin searching full time job falling wikipedia rabbit hole job relates developing biomedical engineering device part already complete working kink two month complete feel two week worth work,0,1,Advice for staying focused at work?
3688,5471,sheltered childhood parent chore decided extracurriculars tutor drove everywhere everything bought mostly everything wanted never job high school never went far nice tree lined suburban neighborhood college parent paid everything living fantasy world nice apartment nice city nice thing going nice dinner weekend thankful help definitely certain income bracket money wont last forever terribly screwed job didnt fully understand thing cost money pay thing getting job didnt know pay water electricity heat didnt know every action consequence pick didnt fully understand way people lie manipulate didnt know life really hard shocking realization mention friend treated free therapy literally didnt know went ok didnt understand basic social interaction ive started first ever full time job month terrible self starter lack social skill navigate office politics independent tell person working doesnt want working project smart enough always pull right complain work good enough cant rid flirted guy work trying help started misunderstood thought interested yeah awkward friend got sick selfish way oh got job connection call mom multiple time day help smart enough thing taught overly dependent socially inept terrible functioning life work hoping time itll better cant help feel cheated independence people age people knew lot thing lot earlier parent let live ranting anyone similar experience eventually grow,1,2,"Overly sheltered and spoiled people, how did you overcome it?"
3769,5580,first full time job benefit benefit paid time annual leave sick leave old job profession part time expectation different culture encouraging taking mental health day self care often needed man people work higher ed see current job lot pto people never call scheduling day advance okay taking sick day great discouraged feel bit stuck afraid take sick day need deal mental health issue make people oriented job difficult bad day bos given supervision mentorship thought position barely talk therefor unclear expectation sure handle got hot water woke monday morning bad migraine lasted day take sick day bos said okay later found pissed address issue communicate problem dance around confrontation result passive aggressive supervisor learning style supervision saying need take sick day every couple week know expectation talk bos act chill party dude thing actually happen navigate talking directly ineffective feel strange feel bad taking sick time earn damn,1,1,"Lots of PTO, not allowed to use it."
4013,5902,hello fellow adult full time job working nothing day sleep go read walk around wherever side paid ok wouldnt money conundrum second job thing day nothing make money b look new fulfilling job hopefully lucky,4,1,Jobs and adulting; a memoir.
4033,5926,upcoming trip december th th seeking advice people start saving trip full time job usually put away rent remaining money checkings saving idk put vacation saving without totally broke day trip advice,1,2,Planning for a vacation
4053,5953,got first full time job start monday past job ive able wear legging jean casual clothes long modest clean professional ive never truly business casual position f feel work clothes bought look old lady clothes doesnt help overweight plantar fasciitis bought really comfortable flat make look year old dress age still look professional,5,1,Don’t know how to dress for work
4059,5959,feel stay home going granny time actually move offense year old living home still kind experiencing fear missing prime bring guy home sneaky parent mainly mom want know every move every guy talk every date going etc dont wrong mom best friend love include made mistake past telling everything ex caused issue pet really want dog cat bunny parent anti furry anything lol clean room time know normal living w th ur parent kind thing grateful fear missing killing die b ever dog night stand probably big deal feel life clock ticking real fast fucked procrastinated lot high school ended got associate degree stopped going school completely figured really wanted last year moved first time live bf currently ex didnt work came back home parent moved realized cant really go school anything requires clinicals rent pay maybe find something part time place want live ghetto cost per month rn make hour enough afford good place kinda hate job boring dont wanna stuck quit work part time apartment seems nearly impossible parent perfect opportunity go back school thing want requires basically full time job medical lab science nursing clinicals hr week aka full time job career going stay parent save apartment pet etc everything going guess know path best staying parent want experience enjoy single best know life short die b experience anything stuck rock hard place decision lol keep pay apartment part want take big loan pay apartment go school clinicals time good idea got way school living paying bill anyone done recommendation adult literally worst,8,4,"Moving out and keeping a job I dont like, or leaving my job and going to school for 2 to 4 years and staying home with parents?"
4063,5963,live la financially working full time job career love commuting paying bill living expensive location etc really exhausting mention sit la traffic average hour week leave work tired socialize look others age around seem financial support parent dont theyre still figuring thing rush find job right away college stressed everyday shooting pain chest doctor cant seem understand anxiety med dont know normal feel way feel happy career watch friend travel party socialize dawn dont luxury figuring thing taking time either always working commuting spending day running errand paying bill adulting stuff hit ton brick,2,2,Is it normal to be this stressed?
4162,6097,graduated medium degree luckily landed first full time job television network dont think theyre expecting wear suit anything desk work professional environment jean shirt lmao outfit looking buy cheap professional lot button shirt guess expecting,8,1,What’s the appropriate way to dress for a full time job?
4260,6235,year old finally opportunity secure full time job benefit paid vacation etc jazz never able hold job mental health high school kid real responsibility didnt need job always burnt quick wanna grow crazy sound want bill pay want learn budget want buy car able travel purchase want whenever obv bill saving without job nada discipline,2,1,Wanna learn how to hold a damn job
4270,6247,started full time job f working two part time year regular adult f full time job make time doctor appointment always take time find telehealth hour option really need see psychiatrist dont feel comfortable taking time early new job,30,1,How do adults go to the doctor?
4304,6301,working first full time job graduation learning lot new thing related field want continue learning least maintain reasonable level general knowledge go reading news without falling clickbait getting jaded negative headline continue staying educated general non career non hobby topic wanna start discussion around,8,1,How do you stay updated with news and in general keep educating yourself as an adult?
4314,6312,hi everyone think title state bit background currently student college need part time even full time job work home seasonal job previous start pandemic unfortunately work u job anymore already using two survey website earning good amount money past month love apply better paying job work home anyone good suggestion recommendation please feel free share thanks everyone,12,1,"I'm trying to find jobs that are ""Work From Home"" just because I'm also a full-time student and it makes my schedule easier to work with if I'm working from home. Does anyone know of any online jobs that are legitimate and pay decently?"
4465,6537,almost feel panic attack hour cant go back sleep feel want right feel time passing completely stuck dont know relationship right boyfriend life together great credit great job money saved buy new house wanted feel holding back level success zero credit got great job happend got furloughed dont money saved working atm growing closed never confidence self ability sometimes still dont even parent divorced stayed dad eventually got married felt got pushed side never got learn thing needed help life wanted work school wanted independent stepmom said needed focus school worry thing life mad helpless dad never said anything told thats never necessarily adult wasnt trying didnt want never really knew go moved state live older sister trying guide push comfort zone virus happend gotten great full time job paid hour happy felt finally move forward life finally save wanted needed life dont car accident havent worked month pandemic furloughed finally got scheduled someone job tested positive chose go didnt feel worth life sister pissed saying selfish alot people risking life working right disagreeing know world right already working wasnt furloughed still go work already already contact whoever tested positive different working felt even greater risk really sure going guess rambling wish better position life feel dont know,28,1,Does anyone else feel stuck?
4478,6557,bf bought car previous owner title trying registered name legal requirement need help bill sale seller b bought previous person notice transaction person name partially filled application replacement title person b name notice sale transfer vehicle filled person b name statement lien satisfaction filled person name car expired oregon plate creating list need happen everything straightened list far replace title replace license plate renew tag need done confusing car bought live wa,6,1,Bought a car without title
4511,6599,hey everyone created finance discord people strive financially independent join share journey receive advice along way small tight knit community ask friendly open everyone opinion people knowledge finance entrepreneurship stock trading long term hold pm link provide brief sentence interest,0,1,Finance and Investing Discord
4551,6651,summarize cant put living parent anymore overbearing living child adult despite fact theyve made clear input needed wanted household decision affect respect privacy saved right rush probably job well guess might bit complicated coronavirus add thinking somewhere near college good place affordable housing job availability plan taking full course load online graduate school ive accepted already itll semester still waiting financial aid though feasible full time job enrolled course theyre online know theyll lot flexible idea talking ive never properly lived ive pretty sheltered even begin complicated covid situation advice appreciated,21,1,How do I move out as a graduate student?
4553,6655,background info help dad issue alone constantly meeting new girl getting new girlfriend met recent girlfriend beach last summer fallen madly love reason constantly spend time together time never home anymore bought house sister basically live alone dad love obsessed whatever woman miss single workout class teach every tuesday night something important going doctor appointment something school sister shes band cancel reschedule miss doesnt miss class thats bad onto issue sister first incident happened sister got relationship someone year younger dad never home took upon sneak girl house ive never met girl extremely upset never awake snuck girl easily invited people home stole something broke something anyway kept sneaking little girl choice tell dad course mad doesnt really anything doesnt take phone ground anything camera keep downstairs continues spending time girlfriend dad girlfriend alcoholic dad kinda always party weekend lot drinking involved sister allowed drink big deal household got point wanting every weekend drunk couldnt even walk speak correctly brought dad pissed thought telling bad father dad attempted tell drink anymore continued happen got point sneaking dad alcohol home tattle dad must taken serious kept staying night time girlfriend started trying put foot sister dad couldnt started pulling ill kill card told dad got mad threatens put jail tell need stop worrying trying tell force sister drive hour girlfriend new house long story short dad doesnt give shit sister trouble shes getting pussywhiped sister involved little girl changed completely shes addicted juuls alcohol every time try set straight everything come falling back dad mad think trying keep seeing girlfriend take responsibility threatens sister never kid know work full time job need sister home sneaking people trying kill think shes burden something need advice,3,1,How should I deal with my 16 year old sister?
4565,6674,hope right place ask context full time job place little year resign health reason able go back work applying different place interview week part time position place b love old job back place applied wondering weird accept position part time job place b quit old job back assuming place last time started job place took call back interview actually start job orientation sure guessing part time position place b couple month think dont know strange waste place b time hire look weird resume something thanks insight,1,1,Is it bad/weird to work at a place for only a month?
4591,6712,pretty long put tl dr bottom anyways bit situation looking advice go sorry wrong sub post best think situation bit background summer bit weird situation three month college without job field pandemic height unemployment benefit ending license drive option pretty low luckily outdoor mall across street living managed find job particular store want mention store sake story call og job pay absolute garbage hour minimum wage live hour hour variable work hour week hour week nothing ever consistent schedule job paid bill kept fast forward week later got license car made mention manager nonchalantly og job looking full time job wanted find consistent felt comfortable manager personable gave life advice end shift manager pulled aside asked going start looking job told asap essentially said really wanted keep promoted temporary key holder got raise even though worked month half point month later moved minute away og job making commute minute back schedule still really variable og job rent new place higher needed another job found retail store making hour working pretty hour week still kept og job mostly liked around people worked november thing started take toll getting stressed drive thirty minute og job every day addition working job help supervisor absolutely got everyone nerve made feel stupid asking question even started thinking putting two week point manager liked og job said found full time job leaving felt bad quitting time stuck another two week actually put two week originally talked assistant manager told putting two week told anything store manager however day happened new manager first day experience managing different store chain kind jumped right onto thing td wanted put two week told nessecary part store least old manager told asked anything keep explained situation drive hour every day work already second job mentioned needed money keep staying suggestion work le day week longer shift apparently anything money foolishly accepted day later district manager came apparently store manager og job made mention wanted quit district manager told joking manner think ever want hear putting two week gave coupon go pick free product store hard work essentially staying gift well want quit real time management taken absolute turn worst point three upper level management people working working three go back leaving ring sell stuff customer time corporates expectation stupid unattainable yet lower level staff yelled achieve honestly feel used place walking plus driving hour home working hour week lucky hour really worth time stress put og job especially better paying job minute drive house put two week without guilt tripping roping back upright quit walk put two week absolutely done job still sure want use reference tl dr got job summer help pay bill pay wa horrendous hour stable across street drive kept casually told manager looking consistent better paying job promoted temporary key holder keep eventually got license car moved minute away found better paying job week later stressing job wanted quit verbally told manager putting two week drive take job asked working le day longer shift help agreed stayed manager told district manager put two week district manager told jokingly never put two week gave coupon free item store management become significantly worse feel used want leave best way without roped back,2,1,"How to quit a job that I've tried to quit before, but keep getting roped back into"
4593,6714,know still young anyone definition goddamn really feel massive part life gone without anything show feel passed lot opportunity teenage year scared wasting time look people admire already achieved time everything feel coming short guess help covid going actually anything anyway stuck parent house guess feel pressure make life feel guilty midlife crisis halfway college normal anything make feel better,5,1,Is it normal to feel like your life is slipping away from you at 20?
4623,6750,family f book business past nine year write fiction book sell online unfortunately business yet profitable hate say ha probably made sale total far yet love business lately edited past novel paid hundred dollar past project sibling help general way writing email reviewing illustration artist family social medium post etc want move next year year latest graduated college almost two year history far dependent sheltered family already really feel need solo life experience become independent extends socialization soon covid getting pretty family life know time really change rough plan look getting full time job asap working social outing saving next year half move travel move work abroad end put wrench business parent willing send manuscript electronically editing potental others concern feel bad parent obviously disappointed business output far determined make future exclusive income minimum hugely successful company best feel pressure stay longer keep hustling something spark yet keep delaying right position cue stay go tl dr f debating staying home work family book business risking dependence shelteredness moving away coming year end tie business road take,9,1,Stay in family business or hit the road? Needing perspective.
4666,6807,adulting hard damn f joined sub struggling finding job getting license etc trying life together independence started finished high school proceeded take year school burnt work advanced course parenting little sister attempting mend broken relationship least parent trying keep boyfriend homeless suffering severe depression afraid able go college due expense barely bed tired suicidal overall rough patch however gotten full time job enjoy even though pay minimum license car absent least neutral relationship parent ex boyfriend life actually better friend ever partner gotten antidepressant seem help bed morning even registered start college week made lot improvement recently felt though share really anyone else share might relate time feel still really struggling independent live house owned non nuclear family member really seems dislike coronavirus hit spent time away house living somewhere else partner maintaining house honestly good job last month abruptly moved back house full time work home every time leave room getting yelled absurd reason even fault problem exist scared home try shower friend house nobody else awake mini fridge room threw new grocery kitchen fridge cooked anything moved back scared downstairs apartment hunting month feel necessity gtfo asap every place find either ghetto super sketchy drove past apartment building see armed men stopping vehicle refuse rent college kid anyone without credit causing extreme stress people intended move apartment pretty bed home life advice appreciated anything looking stuff chest share community may understand thanks,2,1,Successes and struggles coexist
4684,6828,rant trying store credit card nothing seems working girl want start building credit research everything seems whole language advice welcome embarrassed ask people irl family know,6,1,Who is credit?!
