,index,selftext,num_comments,score,title
4718,6872,someone please explain starting earlier year health insurance covered suddenly informed parent plan anymore expensive open enrollment ended soon scrape money plan trying insurance figured got new full time job got wondering health insurance every insurance aware call agency quote enroll time year whats time limit anyone versed trying adult usa please explain,2,1,Why does enrolling in health insurance have a time limit??
4745,6918,high school full throttle adulthood managed apartment full time job never taught anything credit want find best way possible build good credit maintain good credit score idea look listen anyone literature advice greatly appreciated,1,1,How to make and maintain good credit?
4760,6939,post suggests able secure job even state experience needed know rejected even automated rejection email point lie resume least land interview talking massive lie small make resume seem fit age two job ever manage land working grocery store hand notice unable consistently work time college otherside workplace take minute bus place asked work hour timetable college finished e g finish college asked go work still personal vehicle taking bus pretty way guaranteed temporary christmas placement understand corona pandemic made endeavor even harder especially lost previous job due come fact struggling financially need form monetary aid gain peace mind going continuing college degree following september debating dropping sake landing potential full time job sake making sure least financial peace mind might wondering parent supportive try best provide everything need want however live alone parent work abroad choice meaning hard enough provide support want mention need pay sister university tuition shes living mom currently brother cost experience outside work volunteering community service extracurricular activity etc made sure put resume update accordingly even still rejected reference live south west uk area honesty situation due stupidity absolutely horrid social anxiety inability motivate put fear judgment aware asking genuine advice proceed want proud happy anything tldr stupid many thing money struggling land job give form peace mind lie resume,4,1,(19M)Should I lie on my resume? Struggling incredibly hard to land even a simple job amidst financial struggles.
4763,6943,started bachelor degree new programme country back first batch time six semester started field sure wanted life wanted degree something supposed lot application based module theory good come written exam well till th semester even though module failed accident fractured skull badly asked take easy month dropped semester providing medical certificate repeat semester make module repeat moved th semester th later repeat module later last year accident guess depressed coz took lot effort finish semester barely passed semester depending availability seat module motivation register year got full time job decided take break pandemic happened sure whether continue degree module availability pain barely module semester want lose current job government job stable may never chance want degree even diploma except edexcel level count diploma level want degree time think want spend half year probably whole course feel waste time lost interest bad thing want study course anymore want degree even course another year feel old start degree atleast feel even need degree build career experience pay majored field lost really lost,0,1,Big read. Need advice.
4796,6989,someone primarily drink water seltzer water plain jane water name dont drink caffeine soda etc tea needle say sometimes crave alternative water stressed really enjoy taste glass red dry wine getting ready start phd part time working full time job healthcare feel stress building dont think wine non water go looking non alcoholic option exists beer figured id poll group option wine realm try,13,1,Does Non alcoholic wine exist?
4860,7075,sorry long asking advice relative experience far boyfriend need move parent house living immensely stressful especially due mother mental illness desperately need advice affirmation something lost trying figure march different problem come apartment currently attend college full time year round online work part time dead end retail job right make enough cheap rental apartment studio lt due state high minimum wage couple city avoid half due dangerous neighborhood place around u minimum second home tourist town email inquiry right touring place next city last potential tour call got right quarantine pull city depressed poorest state handful store population feel mostly year old drive hour half either direction go mall reach anything remotely relevant interest additionally although perhaps le importantly want dog around u allows pet make moving within current area hard pill swallow trying move state want leave city move state spent entire quarantine researching state city picking specific place applying full time job city minimum wage federal minimum many apartment around place hiring interested u applying essential business grocery well non essential imagine part due quarantine business loss hour cut part due fact resume listed state address started sudden health problem gotten point wearing heart monitor month various follow appointment week made neurological misc appointment try find wrong appointment u pinned u current area next month thought long time whether better stay parent couple month longer depending diagnosis need move urgently decided give moving state look place area within parameter current part time wage basically go back top post lost know conflicted feel good answer back told look city housing something considered time never truly attempted worried year wait list briefly considered outright buying home something want stable career entertained idea tiny house van bus house think want go route reason internet access space lived together bedroom year week ago stoked hear friend place building unit available end july however found building problem tenant destructive landlord waiting court reopen evict tenant anyone else move considering eviction take month eta court reopening idea apartment open another gut punch feel nothing working meanwhile situation house terrible ever state confusion desperation boyfriend looking place state new place well original city wanted move even though go another month staying another month staggering incredibly depressing concept especially real end sight want full time job option nigh impossible graduate even know possible city done next year need build career experience meantime spite fact current job leaf completely exhausted time home boyfriend done another three year cap really want change job immediately main job awful struggle second idea apply know live able nail piece puzzle attach piece tldr boyfriend live mentally ill mother economically depressed area future want move state month due health concern trying find place area afford dead end retail job nothing working wrap read post seems conclusion apply full time job area find meantime keep trying apartment want soon possible basically must keep know worn working seems wrong insight advice anecdote anything appreciated thank reading,0,1,"Moving, changing jobs, and crisis"
4953,7216,f child immigrant parent never health insurance america older sibling insurance full time job full time college student dont work living parent idea even start already rejected getting medicaid via dhs office help right direction greatly appreciated,1,1,How do I apply for health insurance in Illinois?
5153,7504,apologize appropriate subreddit please gentle honestly looking advice maybe concern worried son back story single mom year old son tried hard raise independent know loved back son dealt depression anxiety several year smart thoughtful guy well high school small group friend couple girlfriend none friend seemed close keep contact h ended two girl involved hot mess seemed act savior doormat accepted top tier private university full ride scholarship based merit major art fast forward first year college opposite side country large city rigorous program seemed top world first dont think made friend met girl shit together didnt hear told totally fine left nest living life end school year basically failing class girl broke called day final middle basically nervous breakdown advice take final ob went wrong moment finish come home final wasnt going judge safe place come home id month encouraged take year work working full time job future therapy week completely isolates go work work weekend keep started depression medication actually several trying find right ask next year say dont know feel bad seems depressed lonely barely talk anyone sleep lot watch youtube video listens podcasts side note helped leave absence school want go back appears least probation ive told want go community college next year live home dont know mom gut wrenching see need advice help help need help yes adult need independent figure shit something doesnt drive maybe encourage learn live huge urban area getting around seems necessitate driving wish friend go stuff encourage talk thought school etc gah feel helpless seeing hopeless looking back life sure easier le complicated play date coloring book soccer game wasnt prepared thought right track want happy whatever life tl dr single mom depressed son flunked first year college home totally isolated depressed looking advice word wisdom internet people tia,4,1,Advice needed please
5173,7533,ive recently started first full time job happy ive worked part time job often hour week sometimes never permanently ive full time struggling find energy socialise go pretty live partner see nearly everyday go every friday friend group see parent separately twice fortnight theyre priority see weekend recovery time wana lie partner relax honest come friend drained manage meet person week sometimes even job really physically demanding pretty always foot driving wake work ish dont til gone well time ive showered everything home ready collapse somedays ive explained friend meet friend every two month feel drained feel bad friend never wanting go friend want hang cant regularly anyone feel tip please tell ill used labelled boring young adult forever,6,54,Will full time work always stop my social life
5181,7543,year old recent college graduate full time job yr tax ready leave home parent ready leave home apartment area arent cheap baltimore washington area monthly car payment deal hoping find roommate friend either planning moving anytime soon already found place good way find decent roommate,3,1,How to find a roommate?
5269,7655,year old full time job brush teeth vacuum floor dust dish make bed everyday tax halfway adult bug apartment kill hear scooting around room hear mess shit know trying destroy left room fine happy week ago massive spider threw shoe left apartment hour probably built entire family remote corner home please kill remove bug live way forever want bug roommate tldr advice bug extermination,11,1,I (22F) Need Inspiration to Kill Bug
5295,7693,well title state trying rent apartment already submitted application got accepted rent although realtor asking pay first able see contract term condition normal first time dont know process work thanks guy,13,7,Down payment on apartment
5324,7735,first post subreddit bit patient appropriate month ago officially got big girl job pay tax opportunity overtime ever mom got new lexus meaning buy lexus well record mom work panda express make per hour plus monthly bonusesif first impression lexus must fairly cheap looked realized far cheap still making money decided still save lexus sedan potentially add ons make car bit enjoyable right parent generous enough let stay house monthly rent pay current car toyota corolla secondhand dad insurance parent cover everything else long full time job frequently buy grocery though total exceed per week feasibly say purchase lexus end year hope make enough afford base model end next though worried possible either anyone saved new car something similar give tip,3,2,Will it ever be possible for me to afford a higher end car?
5463,7936,hell time first full time job making excellent salary saved month point moving small dog lb dachshund mix load apartment allow pet within price range mo however moment none opening even say zillow apartment com place opening upscale apartment looking mo bedroom bring home mo conceivably swing hoping move apartment range work large price includes everything mean everything open considering going swing leasing office lunch ask need mom house stable reliable money pay bill responsibility idea going getting frustrated scared make christ sake frustrated,4,5,Apartment hunting woes
5535,8040,hiya currently finishing accounting aa want go ba short break want burn currently working full time job believe flexible enough school need worried going back part time job making enough money rent essential someone please give advice manage work school thank,4,1,How should I work and work on my BA?
5575,8097,option young people live state texas offer medicaid obama care adult kid dependent issue prevent working full time job affordable health insurance,7,1,Adult With no health insurance
5582,8105,hello first time poster recently yesterday enrolled health insurance company state able use benefit immediately desperately need new pair glass insurance say getting id card visual side medical dental vision exactly exactly use benefit eye doctor know prospective eye doctor insurance cover yearly exam frame group number know vision insurance id number process using benefit signed fresh college never full time job till health insurance absolutely thing taught school fully lost least grateful company work made process choosing benefit easy looked couple different sub regarding stuff made confused feel easier id card sure present eye doctor proof anything help thanks,5,1,I got a job! With Insurance benefits! Yay! Now what?
5625,8164,really need learn additional computer program order increase job prospect already front computer hour day day full time job time done work hard time motivating spend even time brain cell front computer motivate anyway recently started self studying bed least feel little reward idea people work full time go school work home dont even kid anything motivate,3,1,How do I motivate myself to self-study on the computer after work when I sit on the computer all day at work?
5672,8228,hi everyone ill try keep succinct possible almost loving parent pay everything always want become independent move soon dependent rule expectation allowed date example among others think impede growth freedom adult thats unhealthy age never minding rule dependence delay life experience alone unhealthy think graduated college music performance degree music interesting thing major college cheap local got good scholarship learned lot degree classical singing ive learned interest pop contemporary singing training voice style future career however covid shut performance opportunity whether pop opera possible earn money right anyway aside retired another job parent fiction writing business help lot edit book help illustration etc honest yet profitable past month work online hour day minimum wage pay esl tutor earn money covid thats background question considering creating business likely non music related training networking take year becoming profitable time great safety net hopefully become reliable income time move id year latest dont strong idea business always imagined business income travel slowly develop music career side parent always encouraged entrepreneurship stuck right stay home keep working family business know long take profitable delay adult independence staying home parent arent comfortable sending manuscript email editing possibility someone else stealing seeing work released actually stay home full time job waitress something yet parent highly concerned covid wouldnt let person job right wonder finding remote difficult car drive car technically ultimate say furthermore time create business id take chance instead stuck mention everyone say travel youre young plan financially funded feel stuck current predicament losing year young traveling advice situation appreciated tl dr depended parent entire life need independent stuck creating business getting job staying working family business,7,1,Trying to go from spoiled dependence to adult independence. Advice?
5736,8315,barely moved still trying prepare owning home live fiance month small bed bath fair price want home bought time know thats lot work year little financial background started building credit october credit card use gas car credit score good range ive heard house typical score minimum slowly working way hopeful ill couple year ive never late payment rent credit card bill fiance hasnt got credit card yet shes saving money shes work right pandemic going shes got full time job well putting minimum saving every single month aside getting credit built else prepare buy home next year,4,1,Tips to buying homes?
5893,8534,basically year old live nyc parent work full time job right feel extremely unfulfilled life idea struggle autism adhd making college work difficult venture trying really hard improve despite fault right job doesnt pay great major goal move nyc find apartment live reason nyc expensive feel missing living commuted finished bachelor online dont friend focused graduating finding job thought needed comfortable feel unfulfilled lost friend family becoming agitated theyre moving want stay new york live expensive city right feel empty focused goal adding money saving recently got back touch goal teaching english abroad right thing closed dont know thing improve future teacher,5,1,Why do I feel so unfulfilled even though I shouldn’t be?
5932,8587,anxiety roof lately start first day new job tuesday end around pm however mean start showering getting ready day ive always shower morning type person extra minute sleep seriously considering night time showering even mean hair pony tail everyday anyways major night owl dont bed amish quarantine helped well landed great job terrified ill mess sleep alarm heavy sleeper already alarm phone nightstand alarm clock ordered another thats extra loud place across room see help anyone else gone advice night owl need suddenly wake early additionally ive found idea full time job depressing maybe last year college part time flexible job idea work sleep repeat sound miserable keep dwelling idea ill home ill go bed mean hour spend quality time boyfriend anything doesnt seem worried ill rut depression routine allow ill worried time advice adult waking early tip handling switch working everyday rest life,5,1,Just got my first full time job after college graduation and I’m really scared I’ll be unable to wake up for it and mess things up.
5982,8654,two question long long enough stay full time job recently got curious future hadnt planned staying city make adult friend city dont know anyone know lot people looking covid answer non covid answer,1,1,First full-time job and new city
6097,8822,extension cord safe use mount tv dont long enough power cord cant rewire due living rental,2,1,Are extension cords safe?
6123,8867,hello soon graduated college due mom cant claim dependent come however landed full time job month half ago enroll benefit paying month insurance file independent remain insurance december enroll january life change event losing insurance primary thing mom always sketchy money tax try keep want informed making personal choice curious anyone know may affect working full time claimed dependent coming tax season lose money owe situation essentially stay mom insurance end year file dependent save insurance cost benefit arent best company employer save money satisfaction filing independent uneducated tax sure either situation affect,0,1,Should I stay on my moms insurance until the end of the year in return for her to claim me as a dependent for this year? Please help.
6147,8896,right work bakery big grocery store chain really expexct know gonna every job make hr work roughly hr week part time despite asking full time often drive boyfriend drive take home min voth way shift place often home clise midnight work hard although really sore end shift mental health definitely take toll today went local candy shop loved lady behind counter said hiring gave information literally walk every day close house full time job available getting home pm every day know pay yet suspect lower hour make bakery feel happier candy shop pay le feel stupid take right working creative project feel bring money time work consistently working bakery make difficult hour never consistent develop routine help depression adhd outside work assuming still able pay bill think foolish take job pay le even though everything else graduated december want go grad school next year trying build full career major right save money grad school,5,1,Taking a job that pays less
6194,8952,living apartment roommate car almost paid credit card owe owe medical bill really hoping stimulus check help stop living pay check pay check full time job make hour ive struggling took door dash extra money apply loan big pay medical bill credit card save rest help start building money,3,1,Should I Get A Loan??
6210,8973,lucky full time job standard feel nothing done work anyone else feel waking early commuting office hour work another commute traffic home totally exhausted motivated anything home dinner thing suddenly hour work gone time bed rinse repeat find motivation work continue hobby even clean,3,2,Coping with the lack of time after work
6316,9116,f graduated high school june ive slowly working making resume looking around job listing possible avoid fast food cashier job kind job looking bad idea try full time job first job lastly anyone advice tip anything info help dont driver license live ontario canada going university fall plan year anxious around people hoping avoid cashier job,2,1,Looking for first job
6328,9131,year old year college left think start building credit still student hopefully ill full time job secured graduation id credit built wish posted start college hey hopefully late couple concern question need constant source income apply credit card currently getting unemployment benefit count source income really dont many hefty monthly purchase tuition rent parent pay incredibly grateful reasonable still apply credit card thing buy thing gas grocery know question likely find answer google search awesome hear anyones input situation advice suggestion bank type card greatly appreciate,6,1,Getting a credit card/building credit
6395,9237,soul kid responsible level headed job car paid everything moved bought home full time job bank respectable everything become adult fast thoroughly none bad consequence choice way went fast back undo redo many called adult accomplishment sold house moved back folk afford college sold car afford move another state grad school graduated recession first learned tell difference fair weather friend real took full time job car live house still renting know feel bad sitting eating gummies many thing adulting okay suck good great thing adulting decide want took realize,4,10,I've decided I'm only going to eat the flavors I like from the fruit gummies pack and that's okay because I'm a freaking adult
6406,9251,recently started first full time job seamstress red flag hired spot bos talk employee respect hence turnover rate fast feel learning lot improving skill positive however interviewed told starting pay hour well two week passed received two check felt seemed low working hour week thought may tax file single independent realize likely lied starting pay dont know approach situation work small business isnt really anyone talk regard human resource quit demand reimbursement,12,1,"First Full Time Job, Boss Lied About Starting Pay"
6467,9331,hi orphan michigan currently placed foster parent work full time job hoping start earning college credit addition high school course understand independent living program people situation already mature fiscally independent person honest think daily meeting laundry properly balance budget going give benefit trying best figure apartment signed next year go live college campus advice greatly appreciated,4,1,How to get an apartment at 15?
6483,9349,seeing therapist month really bad breakdown winter great helping issue hole want focus issue seems comfortable skilled talking plus office city university wa hour away accepted full time job moving even away end month healthy way break therapist accepted normal go plan research option city moving soon box figure honest talk session know thanks advance,2,1,"How can I ""break up"" with my therapist?"
