,index,selftext,num_comments,score,title
1899,3071,parent divorce mom relied sister money sister work life low income mom doesnt bother money cant spare twice year come moment mom tell usd checking account didnt enough automatic house payment close half brings home per month go paying payday loan electricity supposed turned last week extended rd cant pay supposed use car collateral payday loan drive work yesterday cat broke half life problem cant manage money boyfriend year unemployed sits around house day doesnt make work anything insane grad school really nice full time job great benefit financially healthy first time adult life student loan refund come next week mom know told month need every dollar cannot give already asked last week open answer acted offended didnt even want talk said say say answer ill keep saying saving money slowly furnishing new apartment great living away family problem mom fuck ive worked hard ask coming trouble trying apply credit card ssn info watch thing well ive told next time ill pursue legal action dont care shes mom already feel pressure talking going home little possible dealt kind thing advice,5,1,My mom is going to beg me for money again.
1912,3090,sup new ish adult first full time job july adulting done really good sometimes working time week bullet journaling even flossing got holiday came went still lazy fuck eating shit gone anything going everything anything going nothing know smoking weed contributes laziness take adderall morning productive work soon home wanna change pajama smoke lay bed cat rest day still productive sometimes laundry tuesday depressed love lazy inevitably lead self loathing want nip bud reach point addictive personality easily overdo thing overdo smoking eating easily anyone else problem motivate schedule spend productive versus lazy fellow thc user cracked habit buying weed smoke first started job gradually increased used smoke college,1,1,How do you get back into ~the swing of things~
1971,3163,hi year old never learned drive severe driving anxiety behind wheel twice life ultimatum need learn drive october big trouble dad willing teach always making excuse afraid tip beginner help ease anxiety make easier general really suck rely parent full time job well ready independent thanks advance,9,7,Learning to drive
2006,3204,college senior applying full time job male dominated field really frustrating ive applied place reached back talked child idea talking taken seriously,12,91,"Applying for a full time jobs, tired of being talked down to"
2008,3206,quick context woman current full time job sale year half bos asked month ago interested going business trip overseas hq located obviously agreed excited nervous opportunity suddenly flight leaf next friday th receive daily stipend hotel reservation flight booked passport etc think logistics standpoint set idea expect anyone give pointer flying bos flying back make sure dressed formally despite long travel expect sit together unprofessional doze red eye attend business dinner assumed go company card pay using stipend alcohol impolite order water others drinking expected spend free time hotel bos lot question going leave thanks advance,12,25,Tips for my first business trip?
2011,3209,hi currently working full time technically college student still taking class right graduating may went college full time problem going class pm homework nowadays ive found bit difficult stay motivated keep thing work e call friend hobby cook etc ill home long day work plop couch waste hour without knowing havent graduated yet really need butt gear make sure full time job ready graduation tip trick stay motivated list done ive considering sitting weekend completely scheduling week calendar seems excessive tia,5,3,How do you stay motivated after work/a long day?
2091,3313,female manage working full time job overnight keeping touch family member sustaining exceptional social life know sound dumb seriously need help advice deal really bad anxiety suffer aspergers extremely mild form autism already hard enough courage energy social day usually sleeping prepare work night see missed call family time usually end forgetting call back getting scared worried wound point dont even energy motivation unlock phone swear mind year old adult thing isnt clicking head,26,60,i need advice.
2181,3435,new adult world graduating college full time job including commuting gone pm every day typical read fun book commute lunch already good dose home make dinner thing around apartment play video game watch tv hour half head bed every day friday night fun weekend back work ala rest life life every single adult know unusual question start getting really discouraging existential crisis level excited low budget living paycheck paycheck thanks,3,2,How to combat the repetitive workweek grind
2214,3498,f turning july still live father insurance plan getting removed end month current full time job really offer health insurance basically curious option getting lot pressure find new job benefit go back school putting lot strain mental health feel really stuck rock hard place,2,1,Health Insurance Options?
2222,3512,currently work full time job making month starting new job day making currently looking apartment orlando area sure prove income starting job help great,6,1,21 year old about to make 2560 a month
2282,3578,bit narcissistic single mother living sister dawn time full time job pay year want move nearer office rent around really want experience living alone know potentially save money roof around nagging say potentially always borrows money scared move still ask money cost double expense note say mother help,6,5,In need of advice: I'm 23 and I want to move out of my Mom's. What are the pros and cons? Do you regret moving out? Is it the best decision of your life? How old were you when you moved out?
2415,3741,want start mentioning medical condition requires stick regular sleep schedule doctor recommends least hour obviously thats f ing unreasonable ive fine hour past year generally go bed pm wake weekday thats way work full time hour day hour week typically home work pm usual routine dish care plant minute regular cleaning minute exercise shower make dinner still time ill tackle bigger task process decluttering right work hobby project etsy shop need schedule appointment manage bill whatnot ive gotta fit add time rare hour anything end night see boyfriend night week weekend little important project task decluttering planning summer garden scheduling appointment paying managing bill dealing little thing come attempting make time boyfriend feel time anything enjoy past year ive finished two project etsy shop havent managed declutter apartment finished two personal project wanted complete havent picked single book started drawing painting spent time girlfriend total time goal ultimately keep art priority eventually quit full time job make art full time job cant even find time project enjoy let alone project sell anyone time saving tip cooking deculttering cleaning adult thing general want make time thing enjoy friend feel way sacrifice time boyfriend health sleeping le sometimes work art project around mostly watch anime play video game together discussed spending le time together week keen seemed offended id rather spend time alone stuff around ignoring sewing machine catch anime want watch lol,11,1,How do you manage having hobbies and relationships as an adult working full time?
2434,3775,f second last semester college two month ago experienced something traumatic home ive difficulty adjusting feeling comfortable home seeing psychiatrist medicated really struggling emotionally feel burdensome home dont car dont credit card credit score currently job paid hr ive applying bunch full time job gotten back dont know p boyfriend talked moved together sure soon able,0,1,should i move out?
2575,3966,started working first full time job never fully understood money going term tax tax liability calculated related w form filled asked dad explain expert stuff follow explains non linear fashion make confusing understand anyone know online resource video explain stuff someone little knowledge work maybe tax dummy book lol,11,1,How can I understand the taxes being taken off my paycheck?
2579,3970,feel finally made point understand adult always excited aged another year sometimes getting older lot time think expectation first want acknowledge significant challenge mental health past year diagnosed depression got back medication last month seeing therapist finally taking care know depression made everything feel bit worse th birthday next month past year life bit tornado first full time job nearly done master degree first pet dog reptile responsible care moved apartment finally damn place way dated first time year ago relationship first time moved five month ago financially independent scary hell think ever accomplish thing past year difficult actually see thing accomplishment raised believe self sufficient goal life pretty people rely others lot failure way typical white american mindset thing really tired exhausted admitting something else raised believe bad weakness even really want part life good time know selfish say lazy whatever really want start enjoying depressed general feeling apathy thing enjoy anything nothing make excited finding difficult muster enthusiasm required school work turning feel big well think wanted accomplish year suppose lot wanted still happy know excited moving forward nothing brings joy know people life smile really wanted place good time feel let,21,1,First birthday I'm not looking forward to.
2581,3972,hi everyone ive considering career love start kind slow doesnt pay school associate art year old find year line work full time job love although really getting grand year hour long include weekend job worth hour want raise family might tough low amount question possible take invest smart getting track comfortable living tldr invest year time rack earnings,6,1,Turning less to more
2590,3984,issue ive need adulting advice kind introvert two friend high school really need attention beg hang time ive caving past two year graduated dont really people hang ive done trip spent way eating dinner usually leave enough time schoolwork barely work part time however full time job online class considered manager position least hour week day week big commitment manager mean hour probably biggest problem job requires talk customer day introvert leaf drained social energy person really want talk boyfriend church duty house rule essentially feel day hobby want pursue need alone time post work nap dont want say dont time friend really dont covid friend struggling going usual taken toll fine honest done people however theyve begged thing thing opened already hesitant feel irresponsible theyre pushy luckily usually go pick food stay house always worry carrying else passed due negligence side however parent house never enough sleep usually cant leave mention claim spend time boyfriend ive dated five year bring knew year old still exists deserve time please note friend arent close know need space usually spend afternoon week think come around whenever owns place mom talking need talk someone really need talk people going therapy probably need med usually talk thing entirely interested feel struggle keep conversation reigned dont want cut entirely need least figure fit dont take entire day work really need sleep id experiment hobby spending day boyfriend person feel completely comfortable around spend day tired anxious balance life specifically friend interaction know sound sided sound terrible person right perspective advice make adult decision going side note boyfriend heading friend house tomorrow bonfire however know going exhausted work tomorrow church stuff next day however want fit nap boyfriend house leave way dark discussed possibly telling parent advised u home certain time mean spend hour sure well take,0,1,Using personal time wisely.
2607,4011,year old female nursing school graduate end december hopefully working nurse around january assuming pas nclex always wanted move live single father rough time recently though told able return school fall virus large part schooling clinical hospital sooooo guess time asked ton friend seems right position move anytime soon went facebook found girl looking something area budget age student weve met go apartment hunting time told bf girl met completely living stranger found facebook understand kind position thats best turn really cool girl feel actually friend met setting reason scared bf right stranger know happen doesnt real full time job neither good lump sum cash plan working new job nanny plan serving job shes dental assistant school work cna hospital unable work living dad bos understands say come back ready feel trust never really know mom agreed co signer weve discussed lot rule need roommate still scary way look august coming need move go tl dr parent forcing month found roommate facebook scary love stranger go,2,1,Extreme anxiety about moving out at 22 during a pandemic
2654,4072,school access friend time took granted sure coworkers reason close maybe two counted work feel alone always talking random people fly public bar restaurant park sporting event etc sure small talk never lead anything know never gonna see bother come go type thing want set group friend school literally impossible unless super close people everyone time limited valuable really bring something table convince people hang mind lone wolf fact probably learned lot damn frustrated socially actually super jealous bitter see young kid hanging know want maybe something wrong way life,1,2,I know it's tougher to make friends now. Does anyone else have it like this? I'll explain.
2756,4212,first full time job four year decided two big reason client work dumb hell handholding thought want anything infuriating care others office started nice issue people relate level people made comment age damn time even though formal education office office clique ey fell favor popular group thing became bad make thing bos yell explain right apologize still frustrating burnt job best sure lack energy show term enthusiasm role write review always raise still joining military month beyond excited needed huge career lifestyle change know challenge wait new chapter sure make last month current job trying anxiety night work seems going okay back office day week going still fill dread even log chat system make anxious tip getting fucking hate job another option empowered see light end made realize unhappy realized,0,1,How do you guys get through when you hate your job?
2828,4322,background info year old got first real full time job month ago worked part time didnt make money starting build saving right saved living parent annoying ideal problem staying long needed save money mainly want move place boyfriend together went period long distance really time plan taking whole year saving want saved make move plan getting place half rent around sufficient amount money saved able even le,4,1,I want to save up 10k before I get my first apartment (splitting rent with roommate) should it be more? Could I get away with less?
2876,4389,going school second bachelor degree even excited learning new field think really love time dreading constant stress occurred done job probably working eight hour day five day week next forty year likely sound spoiled full time job ive summer okay even happy adult life never break,10,6,How do you get used to a daily grind?
2877,4390,year old interested moving work part time job trying find full time job eye set studio apartment phoenix cost month sound deal good true apartment seen rent least month check tell anything know moving,13,7,Is a $200 a month apartment a good deal?
2997,4574,honestly even year old degree time full time job still need drink day explain either help stay foot chaos call daily life wondering majority people prefer facebook id vote using link provided,7,1,Iced Coffee or Iced Chocolate ?
3007,4593,hi f started working current position year ago intern school kept going stopped internship turned first full time job ready leave commute stink switch boss someone even admitted cut manager nice say totally disagree looking opening non serious way month longer eye kind option might hesitation fact resume need work fact feel always middle something work probably normal level nervousness guess last month saw position sounded really exciting thought kicked gear thought applying made feel resume needed worked asap resume something proud enough send job wanted made appointment alma mater career center huge help going make resume stronger basically recreate okay see job want want give resume suit working fixing resume ready guess ever important step applying thing big concern protocol follow work process last day day come told soul work two people tell really want create chatter concern ready give notice anything know process leaving starting something new know need whole excuse well middle something work right guess never true thanks,17,1,"Planning to leave my full time job after 3.5yrs for another. First job post-school, and so first time doing this. I'm nervous.. what do I need to know about leaving?"
3054,4659,hello everyone trying understand insurance world live nyc job yet part time student business admin spanish class left graduate tip understanding insurance currently metroplus medicaid dont complains want understand type insurance getting full time job affect insurance payment need cover premium co play mean information share help understand truly appreciate research outside reddit anything help,1,1,Understating Insurance
3075,4684,started working full time job recently found consumes little spare time home cook every day usually home around pm go bed pm want sacrifice addtional hour time kitchen including actual eating every day tip maintain efficient nutrition full time working single person without sacrificing time daily basis,1,2,Tips on eating/cooking as a single person with a full time job?
3095,4721,got job end september wegmans working overnights part time overnight grocery customer service worker stock shelf work part time st real job ever among circumstance jump right full time job plan start move full time maybe manager something nature realizing think want longer let alone full time think die boredom went cc business administration entrepreneurship nothing literally show grab cart crap put shelf hr night started hr week hr schedule actually really good part help pay dept knew part timer ok cuase real expense make week compared start working night week compared ppl work atmosphere everything seems nice really good benefit part time many helpful personally lasted long enough full time never got job money wanted job enjoy feel important way matter probably living unrealistic fantasy land think actually happen everyone around whined complained growing still stand job want know want start small business someday nothing fancy centered around something guess rant wanted know wait see anything change quick lose mind,0,1,Only months into 1st job and I think I hate it. What should I do?
3111,4746,want put spirit thanksgiving recognize accomplishment strive improvement tenaciously dont enjoy moment enough big year term adulting got first full time job within career field well ive already gotten raise bos happy great benefit pay couldnt happier moved apartment mom house first time take lot new expense scary first totally charge affair sobering liberating dog great took passed two course master degree delayed proved year still going lost even weight ive reached goal weight lb lb focusing building muscle fat didnt adolescence look better ever life age gone xxxl medium shirt waist think damn good looking first time ever getting better went first date learned lot looking guy generally made transition thinking guy actually flirting asking process still working lot progress year thing getting better still working credit score muscle crack windshield etc man good year scared chapter life actually kicking,11,1,It’s been a very good year for me. (25M)
3163,4810,hi adult need advice organize finance background recently graduated got full time job awesome slowly learning adult thing always cannot manage finance saving plan number jotted need save need spend rent money etc etc paycheck currently checking account money mixed end month track saved spent go reading bit saving account understand work exactly term responsibility open kind account please give advice help step adulting ladder advice appreciated,2,1,HELP! So confused about finances and organizing all of it
3181,4834,hi first apology proper place post kindly point right direction way ok title implies set begin first full time job soon ish currently intern current bos say making offer full time employment upcoming month starting mid next week starting work day hour week recently graduated college first time part time student part time employee looking advice manage transition full time far time management work life balance planning thing wish known etc etc really anything got thanks advance,15,38,First Full-Time Job
3204,4864,ive therapy diagnosed clinically depressed never found someone truly comfortable medication year feel okay time still issue self harm depression always set father whether requesting go supposed see half dozen see u click read reveiws ive found website two sure go none seem quite right think ready go back help wonderful thank internet,7,10,How to find a therapist that fits me?
3240,4907,know pretty disgusting thing ask almost sure however hairstylist today refused hair said found nit looked best friend check none u see anything suspicious thing paid deposit hairstylist back instead told reschedule sure anything point feel need professional opinion able tell sure reschedule know ask pharmacy sell louse shampoo maybe help acceptable request,22,34,Can I ask a pharmacist to check my head for lice?
3249,4918,ive awful anxiety trauma related issue life didnt start somewhat getting better recently finally able master degree subsequently obtain keep full time job starting age manager large company earning figure people clue secret loser life year back got boyfriend planning move parent house however broke year ago ive never left parent house want move obviously due age fact parent huge narcissist dont deserve added burden tho pay rent charge reduced rate theyre wealthy paid mortgage year ago bill dead winter cant imagine moving plus hate job debating whether different job moving terrified ending stuck analysis paralysis encouragement story severe late bloomer advice,14,1,"36 and still living with parents, how can I get my act together/any severe late bloomer success stories?"
3254,4924,f working first job part time mother got first job friend friend situation money saved spend car license need full time job know strength need job part time job cutting hourly wage need money need pay mother rent feel enough time wasted tired stagnant point know start option website visit,1,1,What are my options? Where do I start?
3304,4988,embarrassing admit advice truly needed lol cared whole life dad took care married hub asked divorce time together worked full time job entire life never worry bill got paid day transfer money bam done nerve racking terrified someone break apartment want fan going extra noise help sleep make ok money leaf little extra bill paid stress everyone working fall back saving think smile hope nothing go wrong working little saving guilt child split time rotate every day lost without scared make friend dont want die lol advice general dont mean lost yall,1,1,Terrified to adult...
3325,5012,sitting big apartment first full time job love starting wednesday pre employment shit passed think fuck free time every night make dinner weekend two whole day dont spend using free time studying writing essay plus cleaning time adulting weird,6,3,Just graduated and came back from visiting home
3331,5019,year old still enjoy thing enjoyed still live home love room way twin bed plushies game love etc finished university new full time job plan move near future nostalgic love thinking back elementary school day always think fun time interested adulting however interested letting go childhood bad thing,10,3,why can't i let go of my childhood?
3418,5130,husband married little year yes know young loan house got credit score personally credit make year together make better full time job even remotely possible bank give use loan,14,3,Could I get a loan for a house?
3456,5179,always trouble adjusting type person want predictable groove everyday semester wave different class time change sleep eating activity schedule overwhelms biggest concern right sleep creeping weight lack structured exercise control schedule planned time anymore currently work full time job hour shift suburb hour drive away parent home got apartment city school occasionally research lab working senior project definitely lot eating work research max determined week advance daily either house work back bed sleep train city apartment thing meal prepping exercising even clean set clothes become difficult guy tip adjustment mentally flexible,2,1,How can I adjust to multiple living spaces and an unstable schedule?
3494,5225,context full time job fast food manager year planning going back school next august wanting second job put away bunch money cut back hour know job hopping bad working short period time look bad resume dont know cutoff point acceptable bad,14,5,"How short is considered ""bad"" for working a job?"
3512,5253,title suggests got full time job come minimum waste room raise sick pay ive always job fir full time making money ever mainly got wanted keep dog however super proud,4,2,I Got A Full Time Job.
